"","Timestamp","NetID","DOI","TypeOfArticle","OnlineData","AdditionalMaterialNumber","OnlineMaterials1_DOI","OnlineData_1","DataAbsence","DataRunClean","OnlineDataDOI2","OnlineDataHandle2","OnlineDataURL2","DataAvailability","DataAvailabilityAccess","DataAvailabilityExclusive","OtherNotes1","Is there some other online material that you wish to describe","OnlineDataDOI2_1","OnlineDataHandle2_1","OnlineDataURL2_1","DataAvailability2","DataAvailabilityAccess2","DataAvailabilityExclusive2","OtherNotes2","Do you want to describe another dataset","OnlineDataDOI3","OnlineDataHandle3","OnlineDataURL3","DataAvailability3","DataAvailabilityAccess3","DataAvailabilityExclusive3","OtherNotes3","DataRunFinal","OnlineFinalDataDOI","OnlineFinalDataHandle","OnlineFinalDataURL","FinalDataAvailability","FinalDataAvailabilityAccess","FinalDataAvailabilityExclusive","OtherNotesFinal","DataFormatInputs","OnlineDataFormat2","OnlinePrograms","OnlineProgramsInside","OnlineProgramsDOI","OnlineProgramsHDL","OnlineProgramsURL","DocReadmePresent","DocReadmeContent","ProgramFormat","ProgramSequence","ProgramsDocumentation","ProgramsHeaderAuthor","ProgramsHeaderInfo","ProgramsStructureManual","GeneralNotes","How difficult do you think replicating the article will be","OnlineMaterials","OnlineMaterials1","X61","X62","Do you want to describe another dataset provided with the article","OnlineMaterials1_URL","OnlineMaterials2","OnlineMaterials2_URL","OnlineMaterials2_DOI","Is there some other online material that you wish to describe_1","OnlineMaterials3","OnlineMaterials3_URL","OnlineMaterials3_DOI","AnalysisData","OnlineMaterials1_Description","OnlineMaterials2_Description","OnlineMaterials3_Description","Programs","OnlineDataProvided","DataSetNumbers","DataSetClassification1","OnlineDataDOI1","OnlineDataHandle1","OnlineDataURL1","OnlineDataFormat1","DataSetClassification2","OtherNotes2_1","InputData","InputData1","InputDataRef","InputDataDOI1","InputDataURL1","InputDataHandle1","InputDataFormat1","InputDataAvailability1","X94","InputData2","InputDataDOI2","InputDataHandle2","InputDataURL2","InputDataFormat2","InputDataAvailability2","InputDataOtherNotes1","InputDataOtherNotes2","Flag for follow-up","OnlinePrograms_1","[Row 1]","flag2011"
"1","6/11/2015 10:12:25","nab227","10.1257/app.2.1.149","Yes",NA,NA,NA,NA,NA,NA,NA,NA,NA,NA,NA,NA,NA,"No",NA,NA,NA,NA,NA,NA,NA,NA,NA,NA,NA,NA,NA,NA,NA,NA,NA,NA,NA,NA,NA,NA,NA,NA,NA,NA,NA,NA,NA,"https://www.aeaweb.org/aej/app/data/2009-0060_data.zip",NA,NA,"Stata","Yes","Yes","No","No","Yes",NA,1,"Yes","https://www.aeaweb.org/aej/app/data/2009-0060_data.zip",NA,NA,"No",NA,NA,NA,NA,NA,NA,NA,NA,NA,NA,NA,NA,"Yes","Yes",NA,"Input Data",NA,NA,"http://www.aeaweb.org/aej/app/data/2009-0060_data.zip","Stata",NA,NA,"No",NA,NA,NA,NA,NA,NA,NA,NA,NA,NA,NA,NA,NA,NA,NA,NA,NA,NA,NA,0
"2","6/11/2015 10:43:39","yx77","10.1257/app.2.1.165","Yes",NA,NA,"10.1257/app.2.1.165",NA,"Confidential Data, Missing data (no justification)",NA,NA,NA,NA,NA,"No","No",NA,"No",NA,NA,NA,NA,NA,NA,NA,NA,NA,NA,NA,NA,NA,NA,NA,NA,NA,NA,NA,NA,NA,NA,NA,NA,NA,NA,NA,"doi://10.1257/app.2.1.165",NA,"https://www.aeaweb.org/aej/app/data/2008-0151_data.zip",NA,NA,"Stata","Yes","Yes","Yes","Yes","Yes",NA,3,"Yes","https://www.aeaweb.org/articles.php?doi=10.1257/app.2.1.165",NA,NA,"No",NA,NA,NA,NA,NA,NA,NA,NA,NA,NA,NA,NA,"Yes","Yes",NA,"Input Data","doi://10.1257/app.2.1.165",NA,"http://www.aeaweb.org/aej/app/data/2008-0151_data.zip","Stata",NA,NA,"No",NA,NA,NA,NA,NA,NA,NA,NA,NA,NA,NA,NA,NA,NA,NA,NA,NA,NA,NA,0
"3","6/11/2015 11:28:40","nab227","10.1257/app.2.2.95","Yes",NA,NA,NA,NA,NA,NA,NA,NA,NA,NA,NA,NA,NA,"No",NA,NA,NA,NA,NA,NA,NA,NA,NA,NA,NA,NA,NA,NA,NA,NA,NA,NA,NA,NA,NA,NA,NA,NA,NA,NA,NA,NA,NA,"https://www.aeaweb.org/aej/app/data/2008-0202_data.zip",NA,NA,"Stata","Yes","Yes","No","No","No","The instructions for replication given in the readme seem easy to follow",2,"Yes","https://www.aeaweb.org/aej/app/data/2008-0202_data.zip",NA,NA,"No",NA,NA,NA,NA,NA,NA,NA,NA,NA,NA,NA,NA,"Yes","Yes",NA,"Analysis Data",NA,NA,"http://www.aeaweb.org/aej/app/data/2008-0202_data.zip","Stata",NA,NA,"Yes",NA,NA,NA,NA,NA,NA,"Don't know","No",NA,NA,NA,NA,NA,NA,NA,NA,NA,NA,NA,0
"4","6/11/2015 13:08:22","aec247","10.1257/app.2.1.33","Yes",NA,NA,NA,NA,NA,NA,NA,NA,NA,NA,NA,NA,NA,NA,NA,NA,NA,NA,NA,NA,NA,NA,NA,NA,NA,NA,NA,NA,NA,NA,NA,NA,NA,NA,NA,NA,NA,NA,NA,NA,NA,NA,NA,"http://www.aeaweb.org/aej/app/data/2008-0139_data.zip",NA,NA,"Stata","Yes","Yes","No","No","No",NA,2,"No",NA,NA,NA,"No",NA,NA,NA,NA,NA,NA,NA,NA,NA,NA,NA,NA,"Yes","Yes",NA,"Analysis Data",NA,NA,"http://www.aeaweb.org/aej/app/data/2008-0139_data.zip","Stata",NA,NA,"Yes",NA,NA,NA,NA,NA,NA,NA,"No",NA,NA,NA,NA,NA,NA,"The input data were from birth certificates and infant death certificates for the years 1978–1999.  There are no further details on the input data source.",NA,NA,NA,NA,0
"5","6/11/2015 13:19:40","aec247","10.1257/app.2.1.211","Yes",NA,NA,NA,NA,"Confidential Data, Proprietary Data",NA,NA,NA,NA,NA,"Yes","No",NA,NA,NA,NA,NA,NA,NA,NA,NA,NA,NA,NA,NA,NA,NA,NA,NA,NA,NA,NA,NA,NA,NA,NA,NA,NA,NA,NA,NA,NA,NA,"http://www.aeaweb.org/aej/app/data/2009-0014_data.zip",NA,NA,"Stata","Yes","Yes","No","No","No",NA,4,"No",NA,NA,NA,NA,NA,NA,NA,NA,NA,NA,NA,NA,NA,NA,NA,NA,"Yes","No",NA,NA,NA,NA,NA,"Excel, txt, Stata",NA,NA,"Yes","Alachua County, Florida School District",NA,NA,NA,NA,"Stata","No","No",NA,NA,NA,NA,NA,NA,"Need to receive written permission from Alachua County Public Schools, then reach out to author Mark Hoekstra for the deidentified raw dataset.",NA,NA,NA,NA,0
"6","6/11/2015 13:31:46","aec247","10.1257/app.2.2.164","Yes",NA,NA,NA,NA,NA,NA,NA,NA,NA,NA,NA,NA,NA,NA,NA,NA,NA,NA,NA,NA,NA,NA,NA,NA,NA,NA,NA,NA,NA,NA,NA,NA,NA,NA,NA,NA,NA,NA,NA,NA,NA,NA,NA,"http://www.aeaweb.org/aej/app/data/2008-0129_data.zip",NA,NA,"SPSS, Word","Yes","Yes","No","No","No",NA,3,"No",NA,NA,NA,"No",NA,NA,NA,NA,NA,NA,NA,NA,NA,NA,NA,NA,"Yes","Yes",NA,"Analysis Data",NA,NA,"http://www.aeaweb.org/aej/app/data/2008-0129_data.zip","SPSS",NA,NA,"Yes",NA,NA,NA,NA,NA,NA,"Don't know","No",NA,NA,NA,NA,NA,NA,"Researchers collected the data by asking customers at a fast-food sandwich restaurant to complete surveys.",NA,NA,NA,NA,0
"7","6/11/2015 14:12:00","aec247","10.1257/app.2.3.96","Yes",NA,NA,NA,NA,"Proprietary Data",NA,NA,NA,NA,NA,"Yes","No",NA,"No",NA,NA,NA,NA,NA,NA,NA,NA,NA,NA,NA,NA,NA,NA,NA,NA,NA,NA,NA,NA,NA,NA,NA,NA,NA,NA,NA,NA,NA,"http://www.aeaweb.org/aej/app/data/2008-0231_data.zip",NA,NA,"Stata","Yes","Yes","No","No","No",NA,5,"Yes","http://www.aeaweb.org/aej/app/app/2008-0231_app.pdf",NA,NA,NA,NA,NA,NA,NA,NA,NA,NA,NA,NA,"PDF of tables and analysis using a different version of equation (3) in the paper.",NA,NA,"Yes","No",NA,NA,NA,NA,NA,"Confidential",NA,NA,"Yes","Detroit's First Work program and unemployment insturance wage records for the State of Michigan",NA,NA,NA,NA,"Stata","No","No",NA,NA,NA,NA,NA,NA,"Researchers can access microdata through the Upjohn Institute (contact info provided).  Researchers can either submit programs for the Institute research assistants to run, or work directly with the data on the Institute's premises.",NA,NA,NA,NA,0
"8","6/11/2015 14:16:47","aec247","10.1257/app.2.4.42","Yes",NA,NA,NA,NA,NA,NA,NA,NA,NA,NA,NA,NA,"There are 9 Stata datasets in the zip file.","No",NA,NA,NA,NA,NA,NA,NA,NA,NA,NA,NA,NA,NA,NA,NA,NA,NA,NA,NA,NA,NA,NA,NA,NA,NA,NA,NA,NA,NA,"http://www.aeaweb.org/aej/app/data/2008-0100_data.zip",NA,NA,"Stata","Yes","Yes","Yes","No","No",NA,2,"Yes","http://www.aeaweb.org/aej/app/app/2008-0100_app.pdf",NA,NA,"No",NA,NA,NA,NA,NA,NA,NA,NA,NA,"PDF with supplementary tables discussed in the paper.",NA,NA,"Yes","Yes",NA,"Analysis Data",NA,NA,"http://www.aeaweb.org/aej/app/data/2008-0100_data.zip","Stata",NA,NA,"Yes","Indian Census",NA,NA,NA,NA,NA,"Don't know","Yes","India's National Sample Survey",NA,NA,NA,NA,"Don't know",NA,NA,NA,NA,NA,0
"9","6/11/2015 23:29:17","sjh269","10.1257/app.2.1.62","Yes",NA,NA,NA,NA,NA,NA,NA,NA,NA,NA,NA,NA,NA,NA,NA,NA,NA,NA,NA,NA,NA,NA,NA,NA,NA,NA,NA,NA,NA,NA,NA,NA,NA,NA,NA,NA,NA,NA,NA,NA,NA,NA,NA,"https://www.aeaweb.org/aej/app/data/2009-0119_data.zip",NA,NA,"Stata","Yes","Yes","No","No","No",NA,1,"No",NA,NA,NA,"No",NA,NA,NA,NA,NA,NA,NA,NA,NA,NA,NA,NA,"Yes","Yes",NA,"Analysis Data",NA,NA,"http://www.aeaweb.org/aej/app/data/2009-0119_data.zip","Stata",NA,NA,"No",NA,NA,NA,NA,NA,NA,NA,NA,NA,NA,NA,NA,NA,NA,NA,NA,NA,NA,NA,0
"10","6/12/2015 10:38:51","yx77","10.1257/app.2.2.118","Yes",NA,NA,NA,NA,NA,NA,NA,NA,NA,NA,NA,NA,NA,"No",NA,NA,NA,NA,NA,NA,NA,NA,NA,NA,NA,NA,NA,NA,NA,NA,NA,NA,NA,NA,NA,NA,NA,NA,NA,NA,NA,"doi://10.1257/app.2.2.118",NA,"https://www.aeaweb.org/aej/app/data/2008-0229_data.zip",NA,NA,"Stata","Yes","Yes","Yes","Yes","No",NA,2,"Yes","https://www.aeaweb.org/aej/app/app/2008-0229_app.pdf",NA,NA,"No",NA,NA,NA,NA,NA,NA,NA,NA,NA,NA,NA,NA,"Yes","Yes",NA,"Analysis Data","doi://10.1257/app.2.2.118",NA,"http://www.aeaweb.org/aej/app/data/2008-0229_data.zip","Stata",NA,NA,"No",NA,NA,NA,NA,NA,NA,NA,NA,NA,NA,NA,NA,NA,NA,NA,NA,NA,NA,NA,0
"11","6/12/2015 10:44:37","nab227","10.1257/app.2.3.22","Yes",NA,NA,NA,NA,NA,NA,NA,NA,NA,NA,NA,NA,NA,"No",NA,NA,NA,NA,NA,NA,NA,NA,NA,NA,NA,NA,NA,NA,NA,NA,NA,NA,NA,NA,NA,NA,NA,NA,NA,NA,NA,NA,NA,"https://www.aeaweb.org/aej/app/data/2009-0087_data.zip",NA,NA,"Stata","Yes","Yes","No","No","No","The instructions for replication are very simple.",2,"Yes","https://www.aeaweb.org/aej/app/app/2009-0087_app.pdf",NA,NA,"No",NA,NA,NA,NA,NA,NA,NA,NA,NA,"There is an online theoretical appendix.  There is also a readme file included with the data and programs that explains how to replicate.",NA,NA,"Yes","Yes",NA,"Analysis Data",NA,NA,"http://www.aeaweb.org/aej/app/data/2009-0087_data.zip","Stata",NA,NA,"Yes","MP State Agricultural Marketing Board, Commissioner of Land Records, MP, census of India 2001, and a company's business records",NA,NA,NA,NA,NA,"Don't know","No",NA,NA,NA,NA,NA,NA,NA,NA,NA,NA,NA,0
"12","6/12/2015 10:47:46","sjh269","10.1257/app.2.2.1","Yes",NA,NA,NA,NA,NA,NA,NA,NA,NA,NA,NA,NA,NA,"No",NA,NA,NA,NA,NA,NA,NA,NA,NA,NA,NA,NA,NA,NA,NA,NA,NA,NA,NA,NA,NA,NA,NA,NA,NA,NA,NA,NA,NA,"http://www.aeaweb.org/aej/app/data/2008-0126_data.zip",NA,NA,"Stata","Yes","Yes","No","No","No",NA,1,"Yes","https://www.aeaweb.org/aej/app/app/2008-0126_app.pdf",NA,NA,"No",NA,NA,NA,NA,NA,NA,NA,NA,NA,"A table of correlations and graphs",NA,NA,"Yes","Yes",NA,"Analysis Data",NA,NA,"http://www.aeaweb.org/aej/app/data/2008-0126_data.zip","Stata",NA,NA,"Yes","Integrated Public Use Micro Sample",NA,NA,NA,NA,NA,"Yes","Yes","Vital Statistics (Census 1933)",NA,NA,NA,NA,"Don't know",NA,NA,NA,NA,NA,0
"13","6/12/2015 10:48:23","yx77","10.1257/app.2.3.46","Yes",NA,NA,NA,NA,"Confidential Data, Proprietary Data",NA,NA,NA,NA,NA,"Yes","Yes",NA,"No",NA,NA,NA,NA,NA,NA,NA,NA,NA,NA,NA,NA,NA,NA,NA,NA,NA,NA,NA,NA,NA,NA,NA,NA,NA,NA,NA,"doi://10.1257/app.2.3.46",NA,"http://www.aeaweb.org/aej/app/data/2009-0141_data.zip",NA,NA,"Stata","No","Yes","No","No","Yes",NA,4,"Yes","https://www.aeaweb.org/aej/app/app/2009-0141_app.pdf",NA,NA,NA,NA,NA,NA,NA,NA,NA,NA,NA,NA,NA,NA,NA,"Yes","No",NA,NA,NA,NA,NA,"Confidential",NA,NA,"Yes","Simaniger",NA,NA,"http://www.sima-niger.net/index.php",NA,"Stata","No","Yes","Niger",NA,NA,"http://www.ne.zain.com/fr/.","Stata","No",NA,NA,NA,NA,NA,0
"14","6/12/2015 11:03:55","yx77","10.1257/app.2.3.228","Yes",NA,NA,NA,NA,"Confidential Data",NA,NA,NA,NA,NA,"Yes","Yes",NA,"No",NA,NA,NA,NA,NA,NA,NA,NA,NA,NA,NA,NA,NA,NA,NA,NA,NA,NA,NA,NA,NA,NA,NA,NA,NA,NA,NA,"doi://10.1257/app.2.3.228",NA,"http://www.aeaweb.org/aej/app/data/2009-0244_data.zip",NA,NA,"Stata","No","No","No","No","Yes",NA,3,"Yes","https://www.aeaweb.org/aej/app/app/2009-0244_app.pdf",NA,NA,NA,NA,NA,NA,NA,NA,NA,NA,NA,NA,NA,NA,NA,"Yes","No",NA,NA,NA,NA,NA,"Confidential",NA,NA,"Yes","University of Chicago",NA,NA,NA,NA,"Stata","No","No",NA,NA,NA,NA,NA,NA,NA,NA,NA,NA,NA,0
"15","6/12/2015 11:13:06","yx77","10.1257/app.2.4.177","Yes",NA,NA,NA,NA,"Confidential Data",NA,NA,NA,NA,NA,"Yes","Yes",NA,NA,NA,NA,NA,NA,NA,NA,NA,NA,NA,NA,NA,NA,NA,NA,NA,NA,NA,NA,NA,NA,NA,NA,NA,NA,NA,NA,NA,"doi://10.1257/app.2.4.177",NA,"http://www.aeaweb.org/aej/app/data/2009-0248_data.zip",NA,NA,"Stata","Yes","Yes","Yes","Yes","No",NA,3,"No",NA,NA,NA,NA,NA,NA,NA,NA,NA,NA,NA,NA,NA,NA,NA,NA,"Yes","No",NA,NA,NA,NA,NA,"Confidential",NA,NA,"Yes","Insurance Company",NA,NA,NA,NA,"Stata","No","No",NA,NA,NA,NA,NA,NA,NA,NA,NA,NA,NA,0
"16","6/12/2015 11:42:29","nab227","10.1257/app.2.3.205","Yes",NA,NA,NA,NA,NA,NA,NA,NA,NA,NA,NA,NA,"The article did not mention making any changes to the data but also did not mention how to find the original data.","No",NA,NA,NA,NA,NA,NA,NA,NA,NA,NA,NA,NA,NA,NA,NA,NA,NA,NA,NA,NA,NA,NA,NA,NA,NA,NA,NA,NA,NA,"https://www.aeaweb.org/aej/app/data/2008-0221_data.zip",NA,NA,"Stata","Yes","Yes","No","No","No","The instructions given for replication are very long and there are a lot of do files and data files.",3,"Yes","https://www.aeaweb.org/aej/app/data/2008-0221_data.zip",NA,NA,"No",NA,NA,NA,NA,NA,NA,NA,NA,NA,"There is a readme file that has steps for replication.",NA,NA,"Yes","Yes",NA,"Don't Know",NA,NA,"http://www.aeaweb.org/aej/app/data/2008-0221_data.zip","Stata",NA,NA,"No",NA,NA,NA,NA,NA,NA,NA,NA,NA,NA,NA,NA,NA,NA,NA,NA,NA,NA,NA,0
"17","6/12/2015 12:27:47","sjh269","10.1257/app.2.2.179","Yes",NA,NA,NA,NA,NA,NA,NA,NA,NA,NA,NA,NA,NA,NA,NA,NA,NA,NA,NA,NA,NA,NA,NA,NA,NA,NA,NA,NA,NA,NA,NA,NA,NA,NA,NA,NA,NA,NA,NA,NA,NA,NA,NA,NA,NA,NA,"Missing",NA,NA,NA,NA,NA,"The data is supplied, but there does not seem to be any code or replicating that needs to be done",1,"No",NA,NA,NA,"No",NA,NA,NA,NA,NA,NA,NA,NA,NA,NA,NA,NA,"No","Yes",NA,"Analysis Data",NA,NA,"http://www.aeaweb.org/aej/app/data/2009-0187_data.zip","Excel",NA,NA,"Yes",NA,NA,NA,NA,NA,NA,"Yes","No",NA,NA,NA,NA,NA,NA,"Disclosure forms if financial and business interests for members of parliament",NA,NA,NA,NA,0
"18","6/12/2015 12:44:51","sjh269","10.1257/app.2.3.129","Yes",NA,NA,NA,NA,NA,NA,NA,NA,NA,NA,NA,NA,NA,"No",NA,NA,NA,NA,NA,NA,NA,NA,NA,NA,NA,NA,NA,NA,NA,NA,NA,NA,NA,NA,NA,NA,NA,NA,NA,NA,NA,NA,NA,"http://www.aeaweb.org/aej/app/data/2008-0059_data.zip",NA,NA,"Stata","Yes","Yes","No","No","No",NA,2,"Yes","https://www.aeaweb.org/aej/app/app/2008-0059_app.pdf",NA,NA,"No",NA,NA,NA,NA,NA,NA,NA,NA,NA,"Technical Appendix, Supplementary Decomposition Tables",NA,NA,"Yes","Yes",NA,"Analysis Data",NA,NA,"http://www.aeaweb.org/aej/app/data/2008-0059_data.zip","Stata",NA,NA,"Yes","National Longitudinal Study of the High School Class of 1972",NA,NA,NA,NA,NA,"Don't know","Yes","National Educational Longitudinal Study of 1988",NA,NA,NA,NA,"Don't know",NA,NA,NA,NA,NA,0
"19","6/12/2015 12:53:48","sjh269","10.1257/app.2.4.76","Yes",NA,NA,NA,NA,NA,NA,NA,NA,NA,NA,NA,NA,NA,"No",NA,NA,NA,NA,NA,NA,NA,NA,NA,NA,NA,NA,NA,NA,NA,NA,NA,NA,NA,NA,NA,NA,NA,NA,NA,NA,NA,NA,NA,"http://www.aeaweb.org/aej/app/data/2009-0106_data.zip",NA,NA,"Stata","Yes","Yes","No","No","No",NA,1,"Yes","https://www.aeaweb.org/aej/app/app/2009-0106_app.pdf",NA,NA,"No",NA,NA,NA,NA,NA,NA,NA,NA,NA,"Details of sample creation, detailing replication of an older paper, graphs",NA,NA,"Yes","Yes",NA,"Analysis Data",NA,NA,"http://www.aeaweb.org/aej/app/data/2009-0106_data.zip","Stata",NA,NA,"Yes","NLSY79",NA,NA,NA,NA,NA,"Don't know","No",NA,NA,NA,NA,NA,NA,NA,NA,NA,NA,NA,0
"20","6/14/2015 8:50:49","yc769","10.1257/app.2.1.116","Yes",NA,NA,NA,NA,NA,NA,NA,NA,NA,NA,NA,NA,"The datasets are: the National Longitudinal Survey of the High School Class of 1972 (NLS-72), Baccalaureate and Beyond (B&B), and the College and Beyond database (C&B). The first two datasets provide a snapshot of a nationally representative sample of HBCU students at two points in time: 1972 and 1992.","No",NA,NA,NA,NA,NA,NA,NA,NA,NA,NA,NA,NA,NA,NA,NA,NA,NA,NA,NA,NA,NA,NA,NA,NA,NA,NA,NA,NA,NA,"https://www.aeaweb.org/aej/app/data/2007-0085_data.zip",NA,NA,"Stata, SAS","Yes","Yes","No","No","No","The dataset are pretty chaotic, the folder organization is different than described in readme file.",4,"Yes","https://www.aeaweb.org/aej/app/app/2007-0085_app.pdf",NA,NA,"No",NA,NA,NA,NA,NA,NA,NA,NA,NA,"describes the density distribution of different propensity score

and makes comparison between HBCU and TWI",NA,NA,"Yes","Yes",NA,"Input Data",NA,NA,"http://www.aeaweb.org/aej/app/data/2007-0085_data.zip","Stata, CSV, SAS",NA,NA,"Yes","National Longitudinal Survey of the High School Class of 1972 (NLS-72), Baccalaureate and Beyond (B&B), and the College and Beyond database (C&B).",NA,NA,NA,NA,"Stata, CSV","Don't know","No",NA,NA,NA,NA,NA,NA,"It is noted that some dataset are removed from a folder,

However, I can actually see those supposedly removed datasets stored in the very folder.

Those dataset seems to be central to the analysis",NA,NA,NA,NA,0
"21","6/14/2015 17:23:10","nab227","10.1257/app.2.4.150","Yes",NA,NA,NA,NA,NA,NA,NA,NA,NA,NA,NA,NA,NA,"No",NA,NA,NA,NA,NA,NA,NA,NA,NA,NA,NA,NA,NA,NA,NA,NA,NA,NA,NA,NA,NA,NA,NA,NA,NA,NA,NA,NA,NA,"https://www.aeaweb.org/aej/app/data/2009-0223_data.zip",NA,NA,"Stata, SAS","Yes","Yes","No","No","No",NA,3,"Yes","https://www.aeaweb.org/aej/app/data/2009-0223_data.zip",NA,NA,"No",NA,NA,NA,NA,NA,NA,NA,NA,NA,"Contains readme files that have replication instructions.  There is also an online appendix.",NA,NA,"Yes","Yes",NA,"Analysis Data",NA,NA,"http://www.aeaweb.org/aej/app/data/2009-0223_data.zip","Stata",NA,NA,"Yes","Ontario Ministry of Education",NA,NA,NA,NA,NA,"Don't know","No",NA,NA,NA,NA,NA,NA,NA,NA,NA,NA,NA,0
"22","6/15/2015 9:14:04","yc769","10.1257/app.2.2.72","Yes",NA,NA,NA,NA,NA,NA,NA,NA,NA,NA,NA,NA,"It seems that the author arrive at final result directly from the input data without involving analysis data","No",NA,NA,NA,NA,NA,NA,NA,NA,NA,NA,NA,NA,NA,NA,NA,NA,NA,NA,NA,NA,NA,NA,NA,NA,NA,NA,NA,NA,NA,"https://www.aeaweb.org/aej/app/data/2007-0058_data.zip",NA,NA,"Stata","Yes","Yes","Yes","Yes","No","Data and programs seems to be pretty simple

there's only one program code file which is very well documented",2,"Yes","https://www.aeaweb.org/aej/app/app/2007-0058_app.pdf",NA,NA,"No",NA,NA,NA,NA,NA,NA,NA,NA,NA,"descriptive statistics on supporting data, 

including malaria prevalence and decline of malaria prevalence, also includes graph of labor participation rate",NA,NA,"Yes","Yes",NA,"Input Data",NA,NA,"http://www.aeaweb.org/aej/app/data/2007-0058_data.zip","Stata, CSV",NA,NA,"No",NA,NA,NA,NA,NA,NA,NA,NA,NA,NA,NA,NA,NA,NA,NA,NA,NA,NA,NA,0
"23","6/15/2015 9:48:09","yc769","10.1257/app.2.2.241","Yes",NA,NA,NA,NA,"need to retrieve them from the particular school",NA,NA,NA,NA,NA,"Yes","No",NA,"No",NA,NA,NA,NA,NA,NA,NA,NA,NA,NA,NA,NA,NA,NA,NA,NA,NA,NA,NA,NA,NA,NA,NA,NA,NA,NA,NA,NA,NA,"https://www.aeaweb.org/aej/app/data/2009-0137_data.zip",NA,NA,"Stata","Yes","No","No","No","No","Data is missing in this research

Also, there are a lot of do files which means a lot of program to run.

It appears each do file set its own root folder, which means the replicator will have to adjust them all

Lastly, the readme file is very poorly formatted....",5,"Yes","http://www.aeaweb.org/aej/app/app/2009-0137_app.pdf",NA,NA,NA,NA,NA,NA,NA,NA,NA,NA,NA,NA,"Addition detail on the school where the research is conducted.

Also contains another approach to the same topic of this paper: Mote Caro Simulation",NA,NA,"Yes","No",NA,NA,NA,NA,NA,"Confidential",NA,NA,"Yes",NA,NA,NA,NA,NA,"Stata","Don't know","No",NA,NA,NA,NA,NA,NA,"The author states that those data could be obtained by submitting request to the school where the research is conducted

""The orginal data used in this paper can be obtained from Bocconi University by
contacting Lorenzo Peccati (lorenzo.peccati@unibocconi.it) and submitting a specific
research project (which can very well be the mere replication of our results).""",NA,NA,NA,NA,0
"24","6/15/2015 10:52:11","yc769","10.1257/app.2.3.190","Yes",NA,NA,NA,NA,NA,NA,NA,NA,NA,NA,NA,NA,"the specific information is detailed in readme file, which record each columns of tables",NA,NA,NA,NA,NA,NA,NA,NA,NA,NA,NA,NA,NA,NA,NA,NA,NA,NA,NA,NA,NA,NA,NA,NA,NA,NA,NA,NA,NA,NA,"https://www.aeaweb.org/aej/app/data/2009-0154_data.zip",NA,NA,"Stata","No","No","No","No","Yes","The program needs a lot of configuration before being runnable, which increases dificulties of replication

However, all programs are organized around tables they produce, which makes checking agianst paper easy.",3,"No",NA,NA,NA,"No",NA,NA,NA,NA,NA,NA,NA,NA,NA,NA,NA,NA,"Yes","Yes",NA,"Input Data",NA,NA,"http://www.aeaweb.org/aej/app/data/2009-0154_data.zip","Stata",NA,NA,"No",NA,NA,NA,NA,NA,NA,NA,NA,NA,NA,NA,NA,NA,NA,NA,NA,NA,NA,NA,0
"25","6/24/2015 13:18:28","yx77","10.1257/app.2.4.42","Yes",NA,NA,NA,NA,NA,NA,NA,NA,NA,NA,NA,NA,NA,"No",NA,NA,NA,NA,NA,NA,NA,NA,NA,NA,NA,NA,NA,NA,NA,NA,NA,NA,NA,NA,NA,NA,NA,NA,NA,NA,NA,"doi://10.1257/app.2.4.42",NA,"http://www.aeaweb.org/aej/app/data/2008-0100_data.zip",NA,NA,"Stata","Yes","Yes","No","No","No",NA,2,"Yes","http://www.aeaweb.org/aej/app/app/2008-0100_app.pdf",NA,NA,"No",NA,NA,NA,NA,NA,NA,NA,NA,NA,NA,NA,NA,"Yes","Yes",NA,"Analysis Data",NA,NA,"http://www.aeaweb.org/aej/app/data/2008-0100_data.zip","Stata",NA,NA,"No",NA,NA,NA,NA,NA,NA,NA,NA,NA,NA,NA,NA,NA,NA,NA,NA,NA,NA,NA,0
"26","6/26/2015 17:46:21","hs456","10.1257/app.2.1.193","Yes",NA,NA,NA,NA,"Confidential Data",NA,NA,NA,NA,NA,"Yes","No",NA,"No",NA,NA,NA,NA,NA,NA,NA,NA,NA,NA,NA,NA,NA,NA,NA,NA,NA,NA,NA,NA,NA,NA,NA,NA,NA,NA,NA,NA,NA,"http://www-aeaweb-org.proxy.library.cornell.edu/aej/app/data/2009-0079_data.zip",NA,NA,"Stata","No","Yes","No","No","No","The article itself shows summary statistics revealing certain ""socio-demographic characteristics"" of their participants.  This is not input raw data, but it is as close as it gets in this article.",3,"Yes","https://www-aeaweb-org.proxy.library.cornell.edu/aej/app/app/2009-0079_app.pdf",NA,NA,NA,NA,NA,NA,NA,NA,NA,NA,NA,NA,"Readme describes contact information of person if one wants to get access to data.  Also just states that two do-files are available for view.

Appendix shows several tables revealing correlations between ""present-biased preferences"" and ""credit card borrowing"".",NA,NA,"Yes","No",NA,NA,NA,NA,NA,"Confidential",NA,NA,"Yes","Federal Reserve Bank of Boston",NA,NA,NA,NA,NA,"No","No",NA,NA,NA,NA,NA,NA,"Contact information is given for those requesting the data.  In this sense, the data is not publicly available, but it is not stringently restricted to the authors.",NA,NA,NA,NA,0
"27","6/26/2015 18:09:52","hs456","10.1257/app.2.2.147","Yes",NA,NA,NA,NA,"Proprietary Data",NA,NA,NA,NA,NA,"DK","DK",NA,"No",NA,NA,NA,NA,NA,NA,NA,NA,NA,NA,NA,NA,NA,NA,NA,NA,NA,NA,NA,NA,NA,NA,NA,NA,NA,NA,NA,NA,NA,NA,NA,NA,"Missing",NA,NA,NA,NA,NA,"There are, instead of code, just plain statistical equations and graph visuals showing advanced EITC participation and 401(k) participation with time.  Input dataset is described, but source is extremely vague.",4,"Yes","https://www-aeaweb-org.proxy.library.cornell.edu/aej/app/app/2008-0124_app.pdf",NA,NA,NA,NA,NA,NA,NA,NA,NA,NA,NA,NA,"Appendix describes a preliminary survey, aside from the main article, done by the author.  It also details statistical formulae for modeling Advanced EITC participation.  Later, there are many tables on increased Advanced EITC participation, and has forms and marketing fliers related to it.",NA,NA,"No","No",NA,NA,NA,NA,NA,"Confidential",NA,NA,"Yes","""large-scale, nationwide firm in the retail sector""",NA,NA,NA,NA,NA,"No","No",NA,NA,NA,NA,NA,NA,NA,NA,NA,NA,NA,0
"28","6/27/2015 12:19:16","hs456","10.1257/app.2.3.60","Yes",NA,NA,NA,NA,NA,NA,NA,NA,NA,NA,NA,NA,"All three data files are used to run a regression test, hence analysis data.",NA,NA,NA,NA,NA,NA,NA,NA,NA,NA,NA,NA,NA,NA,NA,NA,NA,NA,NA,NA,NA,NA,NA,NA,NA,NA,NA,NA,NA,NA,"http://www-aeaweb-org.proxy.library.cornell.edu/aej/app/data/2007-0006_data.zip",NA,NA,"Stata","Yes","Yes","No","No","No","An appendix is in fact attached at the end of the article, but it provides proofs to support their theoretical framework, and also states the various games played in the experiment.",1,"No",NA,NA,NA,"No",NA,NA,NA,NA,NA,NA,NA,NA,NA,NA,NA,NA,"Yes","Yes",NA,"Analysis Data",NA,NA,"http://www-aeaweb-org.proxy.library.cornell.edu/aej/app/data/2007-0006_data.zip","Stata",NA,NA,"No",NA,NA,NA,NA,NA,NA,NA,NA,NA,NA,NA,NA,NA,NA,NA,NA,NA,NA,NA,0
"29","6/27/2015 12:53:01","hs456","10.1257/app.2.3.256","Yes",NA,NA,NA,NA,NA,NA,NA,NA,"http://www-aeaweb-org.proxy.library.cornell.edu/aej/app/data/2009-0180_data.zip",NA,NA,NA,"Data files with the name ""oecd"" in them are input data obtained from the UN.  ""imf_gdp,"" ""io_data,"" and ""us_monthly_trade"" are input data directly from a US government department as well as the IMF.","No",NA,NA,NA,NA,NA,NA,NA,NA,NA,NA,NA,NA,NA,NA,NA,NA,NA,NA,NA,NA,NA,NA,NA,NA,"Stata",NA,NA,NA,NA,"http://www-aeaweb-org.proxy.library.cornell.edu/aej/app/data/2009-0180_data.zip",NA,NA,"Stata","Yes","Yes","Yes","Yes","Yes",NA,3,"Yes","https://www-aeaweb-org.proxy.library.cornell.edu/aej/app/app/2009-0180_app.pdf",NA,NA,"Yes",NA,NA,NA,NA,NA,NA,NA,NA,NA,"Readme describes all dta files and their source, and how to run the do files (in downloadable dataset).

Appendix shows various tables and graphs displaying worsening attitudes, French and American commodities, etc.",NA,NA,"Yes","Yes",NA,"Input Data",NA,NA,"http://www-aeaweb-org.proxy.library.cornell.edu/aej/app/data/2009-0180_data.zip","Stata","Analysis Data","All files starting with the word ""data_for"" are used to generate regression.  Regarding the rest of the datasets: all filenames starting with ""table"" merely list the values in the regression tables in the article; and ""figure_months_all.dta"" data, used to create Figure 3 in article, regresses the average of input data.","Yes","UN Comtrade",NA,NA,"http://comtrade.un.org",NA,"Stata","Yes","No",NA,NA,NA,NA,NA,NA,"Must convert data to Stata using Stat transfer.",NA,NA,NA,NA,0
