"377","6/16/2018 14:49:12","vsn9","10.1257/app.20130034","Yes",NA,NA,NA,NA,"Confidential Data",NA,NA,NA,NA,NA,"Yes","No",NA,"No",NA,NA,NA,NA,NA,NA,NA,NA,NA,NA,NA,NA,NA,NA,NA,NA,NA,NA,NA,NA,NA,NA,NA,NA,NA,NA,NA,NA,NA,"https://www.aeaweb.org/articles/attachments?retrieve=eLH1xJsFOGKHqyBGgSF0s35lA34_YE0e",NA,NA,"Stata, Matlab","Yes","Yes","Yes","No","No","Seems like replicators can access the raw input datasets (after signing confidentiality agreements) but not the main analysis dataset painkillers.mat/painkillers.dta",5,"Yes","Author Disclosure Statement https://www.aeaweb.org/articles/attachments?retrieve=YZRDTquE4T4uheSqDdOjKCmFVNLFGOLp",NA,NA,NA,NA,NA,NA,NA,NA,NA,NA,NA,NA,"Author Disclosure Statement",NA,NA,"Yes","No",NA,NA,NA,NA,NA,NA,NA,NA,"Yes","Apoteket AB, Apotekens Servicebolag AB",NA,NA,NA,NA,NA,"No","Yes","Sifo RM, Statistics Sweden",NA,NA,NA,NA,"Don't know","Confidential product level data for the Swedish analgesics market (main dataset)","Additional datasets are marketing expenditures per brand, from Sifo RM, and monthly macro-economic variables (nominal & real gdp, the number of men & women on sick leave) and annual population of men and women, from Statistics Sweden.","No",NA,NA,0
"378","6/16/2018 15:23:43","vsn9","10.1257/app.20150421","Yes",NA,NA,NA,NA,"Confidential Data",NA,NA,NA,NA,NA,"Yes","No",NA,"Yes",NA,NA,NA,NA,NA,NA,NA,NA,NA,NA,NA,NA,NA,NA,NA,NA,NA,NA,NA,NA,NA,NA,NA,NA,NA,NA,NA,NA,NA,"https://www.aeaweb.org/articles/attachments?retrieve=_jGuHbkqc887it0ybX_g1Pk377DxDc8C",NA,NA,"Stata","Yes","Yes","No","No","No",NA,5,"Yes","Online Appendix https://www.aeaweb.org/articles/attachments?retrieve=KHfSpqkGvndRlQLdi85dRzSebGBhGJCa",NA,NA,NA,NA,"Author Disclosure Statement https://www.aeaweb.org/articles/attachments?retrieve=Dd6e8o9vBVp0RtqubsZWIV8j7UQuxeqE",NA,NA,"No",NA,NA,NA,NA,"Online Appendix describing supplemental descriptives, analysis, & author's measure of application quality, providing additional robustness checks, examining additional empirical specifications, etc.","Author Disclosure Statement",NA,"Yes","No",NA,NA,NA,NA,NA,NA,NA,NA,"Yes","National Institutes of Health",NA,NA,NA,NA,NA,"No","Yes","Thomson Reuters Web of Science, National Library of Medicine",NA,NA,NA,NA,"Don't know","NIH administrative data for R01 grant applications, attendance rosters for NIH peer review meetings, and publication databases for life sciences research.","Data on applicant publication history. Authors use PubMed database from NLM.","No",NA,NA,0
"379","6/16/2018 15:53:10","vsn9","10.1257/app.20140473","Yes",NA,NA,NA,NA,NA,NA,NA,NA,"https://www.aeaweb.org/aej/app/data/0802/2014-0473_data.zip",NA,NA,NA,"Weblinks for the original data are listed above or in the raw files themselves.","Yes",NA,NA,NA,NA,NA,NA,NA,NA,NA,NA,NA,NA,NA,NA,NA,NA,NA,NA,NA,NA,NA,NA,NA,NA,"Stata",NA,NA,NA,NA,"https://www.aeaweb.org/aej/app/data/0802/2014-0473_data.zip",NA,NA,"Stata","Yes","Yes","No","No","No","Majority of input datasets are provided",1,"Yes","Online Appendix https://www.aeaweb.org/aej/app/app/0802/2014-0473_app.pdf",NA,NA,"Yes",NA,"Author Disclosure Statement https://www.aeaweb.org/aej/app/ds/0802/2014-0473_ds.zip",NA,NA,"No",NA,NA,NA,NA,"Online Appendix with additional information on dataset construction, discussion of potential confounders, examination of changes in natural gas prices & in other sources in electricity generation, etc.","Author Disclosure Statement",NA,"Yes","Yes",NA,"Input Data",NA,NA,"https://www.aeaweb.org/aej/app/data/0802/2014-0473_data.zip","CSV, Excel","Analysis Data","Analysis datasets are used in most .do files","Yes","EUCG, Platts, & SNL Financial",NA,NA,NA,NA,NA,"No","No",NA,NA,NA,NA,NA,NA,"EUCG’s variable O&M data for nuclear power plants, natural gas prices from Platts, fuel and variable O&M data for power plants from SNL, and wholesale electricity prices from SNL. Used for Figure 1, Table 1, & Appendix Figure A2. Authors state that these raw data cannot be posted (do not specify why).",NA,"No",NA,NA,0
"380","6/16/2018 17:33:13","vsn9","10.1257/app.20150027","Yes",NA,NA,NA,NA,NA,NA,NA,NA,NA,NA,NA,NA,"Input data appears to also be analysis data","No",NA,NA,NA,NA,NA,NA,NA,NA,NA,NA,NA,NA,NA,NA,NA,NA,NA,NA,NA,NA,NA,NA,NA,NA,NA,NA,NA,NA,NA,"https://www.aeaweb.org/articles/attachments?retrieve=dFODdBbUvrRVYnFAhigM71CklKP7gm69",NA,NA,"Stata","Yes","Yes","No","No","No","Unsure about the input/analysis dataset classification",1,"Yes","Author Disclosure Statement https://www.aeaweb.org/articles/attachments?retrieve=Pt3crt4msVhT5gS-1DfAb6iwveAqcP57",NA,NA,"No",NA,NA,NA,NA,NA,NA,NA,NA,NA,"Author Disclosure Statement",NA,NA,"Yes","Yes",NA,"Input Data",NA,NA,"https://www.aeaweb.org/articles/attachments?retrieve=dFODdBbUvrRVYnFAhigM71CklKP7gm69","Stata",NA,NA,"No",NA,NA,NA,NA,NA,NA,NA,NA,NA,NA,NA,NA,NA,NA,NA,NA,"Yes",NA,NA,0
"381","6/17/2018 13:38:50","hat42","10.1257/app.20150512","Yes",NA,NA,NA,NA,"Confidential Data",NA,NA,NA,NA,NA,"Yes","No",NA,"No",NA,NA,NA,NA,NA,NA,NA,NA,NA,NA,NA,NA,NA,NA,NA,NA,NA,NA,NA,NA,NA,NA,NA,NA,NA,NA,NA,NA,NA,"https://www.aeaweb.org/aej/app/data/0802/2014-0506_data.zip",NA,NA,"Stata","Yes","Yes","No","No","No",NA,5,"Yes","https://www.aeaweb.org/aej/app/ds/0802/2014-0506_ds.zip",NA,NA,NA,NA,NA,NA,NA,NA,NA,NA,NA,NA,NA,NA,NA,"Yes","No",NA,NA,NA,NA,NA,NA,NA,NA,"No",NA,NA,NA,NA,NA,NA,NA,NA,NA,NA,NA,NA,NA,NA,NA,NA,NA,NA,NA,0
"382","6/17/2018 14:05:49","hat42","10.1257/app.20160004","Yes",NA,NA,NA,NA,NA,NA,NA,NA,"https://www.aeaweb.org/content/file?id=4728",NA,NA,NA,NA,"Yes",NA,NA,NA,NA,NA,NA,NA,NA,NA,NA,NA,NA,NA,NA,NA,NA,NA,NA,NA,NA,NA,NA,NA,NA,"Stata",NA,NA,NA,NA,"https://www.aeaweb.org/content/file?id=4728",NA,NA,"Stata","Yes","Yes","No","No","No",NA,1,"Yes","https://www.aeaweb.org/articles/attachments?retrieve=sQylPF-LaICzeJrxvnR0Q75x9nSkysyj",NA,NA,"Yes",NA,"https://www.aeaweb.org/articles/attachments?retrieve=7W0la63q4txKAoZIXdRrMK8PwQcmKCgh",NA,NA,"No",NA,NA,NA,NA,"Online Appendix of tables and figures","Author disclosure statements",NA,"Yes","Yes",NA,"Analysis Data",NA,NA,"https://www.aeaweb.org/content/file?id=4728","Stata","Analysis Data",NA,"Yes","Indian District Level Health Survey",NA,NA,"http://ghdx.healthdata.org/record/india-district-level-household-survey-2007-2008",NA,NA,"No","No",NA,NA,NA,NA,NA,NA,"Data appears to be available for research projects by request",NA,"No",NA,NA,0
"383","6/17/2018 14:54:50","nbs52","10.1257/app.20160307","Yes",NA,NA,NA,NA,"Confidential Data, Proprietary Data, Redistribution not authorized",NA,NA,NA,NA,NA,"Yes","No",NA,"Yes",NA,NA,NA,NA,NA,NA,NA,NA,NA,NA,NA,NA,NA,NA,NA,NA,NA,NA,NA,NA,NA,NA,NA,NA,NA,NA,NA,NA,NA,"https://www.aeaweb.org/articles/attachments?retrieve=ZaVUoGIhwsH2nHELGbV450EPwy2gKzlp",NA,NA,"Stata","Yes","Yes","No","No","Yes","As the datasets are either restricted or not easily available, this will be impossible to replicate.",5,"Yes","https://www.aeaweb.org/articles/attachments?retrieve=ewc3NkNlBcPevBU955Rq_4HPycrKg3Gf",NA,NA,NA,NA,"https://www.aeaweb.org/articles/attachments?retrieve=V5pNkIkV2HS4h4sZFuB0L8snXpu5Mfki",NA,NA,"No",NA,NA,NA,NA,"Online Appendix with additional figures and tables","Author Disclosure Statements",NA,"Yes","No",NA,NA,NA,NA,NA,NA,NA,NA,"Yes","Various US Federal Agencies - IRS, Treasury, Social Security Administration",NA,NA,NA,NA,NA,"No","Yes","Bureau of Labor Statistics, Cost of Living Index,  zip-codes.com",NA,NA,NA,NA,"Yes","Confidential, not publicly available, and can not be accessed outside of U.S. Treasury","Bureau of Labor Statistics data freely available, while data from other two sources above are for purchase.","No",NA,NA,0
"384","6/17/2018 16:06:18","ap676","10.1257/app.20150512","Yes",NA,NA,NA,NA,NA,NA,NA,NA,NA,NA,NA,NA,"Constructed from 7 data sources, including the Economic Census of India","No",NA,NA,NA,NA,NA,NA,NA,NA,NA,NA,NA,NA,NA,NA,NA,NA,NA,NA,NA,NA,NA,NA,NA,NA,NA,NA,NA,NA,NA,"https://www.aeaweb.org/articles/attachments?retrieve=3zZQDJgzqQXZC5nsXWmjMUWnwPU-nLjq",NA,NA,"Stata","No","Yes","No","No","Yes","Well-documented, but code/readme is unclear on which lines should be replaced with the directory of the local data folder.",2,"Yes","https://www.aeaweb.org/articles/attachments?retrieve=Q21l6uHG6U_Hp8wHXG3M65kNm4vTKduJ",NA,NA,"No",NA,NA,NA,NA,NA,NA,NA,NA,NA,"Author Disclosure",NA,NA,"Yes","Yes",NA,"Analysis Data",NA,NA,"https://www.aeaweb.org/articles/attachments?retrieve=3zZQDJgzqQXZC5nsXWmjMUWnwPU-nLjq","Stata",NA,NA,"Yes","Government of India",NA,NA,NA,NA,"Don't Know","Don't know","No",NA,NA,NA,NA,NA,NA,"Available for purchase from Ministry of Statistics in India, Census of India",NA,"No",NA,NA,0
"385","6/17/2018 18:00:00","xw435","10.1257/mac.20130322","Yes",NA,NA,"https://www.aeaweb.org/aej/mac/ds/0702/2013-0322_ds.zip",NA,NA,NA,NA,NA,NA,NA,NA,NA,NA,"No",NA,NA,NA,NA,NA,NA,NA,NA,NA,NA,NA,NA,NA,NA,NA,NA,NA,NA,NA,NA,NA,NA,NA,NA,NA,NA,NA,NA,NA,"https://www.aeaweb.org/aej/mac/data/0702/2013-0322_data.zip",NA,NA,"Matlab","Yes","Yes","Yes","No","No",NA,4,"Yes",NA,NA,NA,"No",NA,NA,NA,NA,NA,NA,NA,NA,NA,"Author Disclosure Statement",NA,NA,"Yes","Yes",NA,"Analysis Data",NA,NA,"https://www.aeaweb.org/aej/mac/data/0702/2013-0322_data.zip","Matlab",NA,NA,"No",NA,NA,NA,NA,NA,NA,NA,NA,NA,NA,NA,NA,NA,NA,NA,NA,"No",NA,NA,0
"386","6/18/2018 11:49:34","gab99","10.1257/app.20150044","Yes",NA,NA,NA,NA,NA,NA,NA,NA,"https://www.aeaweb.org/aej/app/data/0801/2015-0044_data.zip",NA,NA,NA,NA,"Yes",NA,NA,NA,NA,NA,NA,NA,NA,NA,NA,NA,NA,NA,NA,NA,NA,NA,NA,NA,NA,NA,NA,NA,NA,"Stata",NA,NA,NA,NA,"https://www.aeaweb.org/aej/app/data/0801/2015-0044_data.zip",NA,NA,"Stata, R","Yes","No","No","No","No","The material provided seems very comprehensive, the authors even provide log files of the code being run.",1,"Yes","https://www.aeaweb.org/aej/app/app/0801/2015-0044_app.pdf",NA,NA,"Yes",NA,"https://www.aeaweb.org/aej/app/ds/0801/2015-0044_ds.zip",NA,NA,"No",NA,NA,NA,NA,"Online appendix that describes in more detail the authors' data selection methods and provides supplementary graphs","Authors' disclosure statements",NA,"Yes","Yes",NA,"Input Data",NA,NA,"https://www.aeaweb.org/aej/app/data/0801/2015-0044_data.zip","Stata, Excel","Analysis Data","Author provides 3 categories of data; input, temporary, and final (analysis). Each category contains upwards of 10 data sets.","No",NA,NA,NA,NA,NA,NA,NA,NA,NA,NA,NA,NA,NA,NA,NA,NA,"No",NA,NA,0
"387","6/18/2018 11:52:12","jhv39","10.1257/app.20150043","Yes",NA,NA,NA,NA,NA,NA,NA,NA,NA,NA,NA,NA,"Combines state level criminal data and individual criminal data","Yes",NA,NA,NA,NA,NA,NA,NA,NA,NA,NA,NA,NA,NA,NA,NA,NA,NA,NA,NA,NA,NA,NA,NA,NA,NA,NA,NA,NA,NA,"https://www.aeaweb.org/content/file?id=2955",NA,NA,"Stata","Yes","Yes","No","No","No",NA,2,"Yes","https://www.aeaweb.org/articles/attachments?retrieve=SKJEoA5Bcz_C3UzwwjgA5A0E8gHTEHDM",NA,NA,"No",NA,"https://www.aeaweb.org/articles/attachments?retrieve=M9PkpV5dtF-Ph1NioVZnaeCxxccNgKys",NA,NA,"No",NA,NA,NA,NA,"Appendix","Disclosure Statements",NA,"Yes","Yes",NA,"Analysis Data",NA,NA,"https://www.aeaweb.org/content/file?id=2955","Stata",NA,NA,"No",NA,NA,NA,NA,NA,NA,NA,NA,NA,NA,NA,NA,NA,NA,NA,NA,"No",NA,NA,0
"388","6/18/2018 15:00:27","gab99","10.1257/app.20140404","Yes",NA,NA,NA,NA,NA,NA,NA,NA,NA,NA,NA,NA,"Author provides 4 analysis data sets from different sources","Yes",NA,NA,NA,NA,NA,NA,NA,NA,NA,NA,NA,NA,NA,NA,NA,NA,NA,NA,NA,NA,NA,NA,NA,NA,NA,NA,NA,NA,NA,"https://www.aeaweb.org/aej/app/data/0802/2014-0404_data.zip",NA,NA,"Stata, Matlab","Yes","Yes","No","No","No","The main issue is one data set referred to by the .do files is not provided since it is proprietary. Also, the ReadMe explains every file, but does not explicitly provide instructions as to how to run everything.",4,"Yes","https://www.aeaweb.org/aej/app/app/0802/2014-0404_app.pdf",NA,NA,"No",NA,"https://www.aeaweb.org/aej/app/ds/0802/2014-0404_ds.zip",NA,NA,"No",NA,NA,NA,NA,"Online appendix with additional tables and figures","Author disclosure statements",NA,"Yes","Yes",NA,"Analysis Data",NA,NA,"https://www.aeaweb.org/aej/app/data/0802/2014-0404_data.zip","Stata",NA,NA,"Yes","NASA and National Geospatial-Intelligence Agency (NGA)",NA,NA,NA,NA,NA,"Yes","Yes","Rand Corporation - National Labor Force Survey (SAKERNAS)",NA,NA,NA,NA,"No","Author is unspecific about where or exactly how to download this data, but has synthesized it into analysis data and provided the analysis data sets.","This data is proprietary, and thus a data request must be sent to bpshq@bps.go.id.","No",NA,NA,0
"389","6/19/2018 0:40:04","cc2553","10.1257/mac.20140234","Yes",NA,NA,NA,NA,NA,NA,NA,NA,"http://real.wharton.upenn.edu/~gyourko/chineselandpriceindex.html",NA,NA,NA,"Readme only mentions a .dta, while the code only uses the excel file. Excel file is put under a raw data folder, and author incorporates a do-file for cleaning so it's possible that the .dta is a cleaned version of the data","Yes",NA,NA,NA,NA,NA,NA,NA,NA,NA,NA,NA,NA,NA,NA,NA,NA,NA,NA,NA,NA,NA,NA,NA,NA,"Stata, Excel",NA,NA,NA,NA,"https://www.aeaweb.org/articles/attachments?retrieve=UzgPTwLRdGTlz9ZWU3dpwKS1aHXo5cFh",NA,NA,"Stata, Matlab","No","Yes","No","No","No",NA,4,"Yes","https://www.aeaweb.org/articles/attachments?retrieve=OglwA_VDJMGItFFXAMezPa6r2j8epkmC",NA,NA,"Yes",NA,"https://www.aeaweb.org/articles/attachments?retrieve=z7O0X7L2Ntw8jvz0fq-5ojkdwA-xKr0i",NA,NA,"No",NA,NA,NA,NA,"Online Appendix","Author Disclosure Statement",NA,"Yes","Yes",NA,"Input Data",NA,NA,"https://www.aeaweb.org/articles/attachments?retrieve=UzgPTwLRdGTlz9ZWU3dpwKS1aHXo5cFh","Stata, Excel","Input Data","original format is excel; author converts it to stata data file","Yes","CSMAR",NA,NA,"https://wrds-web.wharton.upenn.edu/wrds/ds/csmar/index.cfm",NA,"Stata","No","No",NA,NA,NA,NA,NA,NA,"Need to register or pay to access data",NA,"Yes",NA,NA,0
"390","6/19/2018 14:45:02","cc2553","10.1257/mac.20130143","No",NA,NA,NA,NA,NA,NA,NA,NA,NA,NA,NA,NA,NA,NA,NA,NA,NA,NA,NA,NA,NA,NA,NA,NA,NA,NA,NA,NA,NA,NA,NA,NA,NA,NA,NA,NA,NA,NA,NA,NA,NA,NA,NA,NA,NA,NA,NA,NA,NA,NA,NA,NA,NA,NA,NA,NA,NA,NA,NA,NA,NA,NA,NA,NA,NA,NA,NA,NA,NA,NA,NA,NA,NA,NA,NA,NA,NA,NA,NA,NA,NA,NA,NA,NA,NA,NA,NA,NA,NA,NA,NA,NA,NA,NA,NA,NA,NA,NA,NA,NA,NA,0
"391","6/19/2018 18:19:59","nwl27","10.1257/app.20160180","Yes",NA,NA,"10.1257/app.20160180",NA,"Missing data (no justification)",NA,NA,NA,NA,NA,"DK","DK",NA,"No",NA,NA,NA,NA,NA,NA,NA,NA,NA,NA,NA,NA,NA,NA,NA,NA,NA,NA,NA,NA,NA,NA,NA,NA,NA,NA,NA,NA,NA,NA,NA,NA,NA,NA,NA,NA,NA,NA,"Due to the absence of code, this article will be impossible to replicate",5,"Yes","https://www-aeaweb-org.proxy.library.cornell.edu/articles/attachments?retrieve=emk8qC_LAUrIPcDBR1BB5AkFY5d0MRdE",NA,NA,NA,NA,NA,NA,NA,NA,NA,NA,NA,NA,"Author Disclosure Statement(s)",NA,NA,"No","No",NA,NA,NA,NA,NA,NA,NA,NA,"Yes","International Science Foundation",NA,"10.1257/app.20160180",NA,NA,NA,"Don't know","Yes","Thomas Reuters Web of Science","10.1257/app.20160180",NA,"http://apps.webofknowledge.com.proxy.library.cornell.edu/WOS_GeneralSearch_input.do?product=WOS&search_mode=GeneralSearch&SID=6D8dnNnnjKtvVdOBtbr&preferencesSaved=","DK","Don't know","The author writes that they compiled a unique dataset that included information from the ISF archives in Budapest, Hungary, but doesn't describe any way to obtain this data.","Once again, the author was pretty vague with any directions in obtaining the input dataset; they refer to the data they obtained as ""publication data"", but don't point to how to find this data on the database.","No",NA,NA,0
"392","6/19/2018 19:00:02","nwl27","10.1257/app.20150241","Yes",NA,NA,"10.1257/app.20150241",NA,NA,NA,NA,NA,NA,NA,NA,NA,"This dataset was described as ""the data generated by the experiment"" in the README. I read through both the readme file and the data section of the article and couldn't find any descriptions of data cleaning, so I am concluding that it's input data, but I'm not completely sure.","Yes",NA,NA,NA,NA,NA,NA,NA,NA,NA,NA,NA,NA,NA,NA,NA,NA,NA,NA,NA,NA,NA,NA,NA,NA,NA,NA,NA,"10.1257/app.20150241",NA,"https://www-aeaweb-org.proxy.library.cornell.edu/articles/attachments?retrieve=nm-Fy8CS26e2DgD4-LhzThnVVPomeD8S",NA,NA,"Stata","Yes","Yes","No","No","No",NA,1,"Yes","https://www-aeaweb-org.proxy.library.cornell.edu/articles/attachments?retrieve=nm-Fy8CS26e2DgD4-LhzThnVVPomeD8S",NA,NA,"No",NA,"https://www-aeaweb-org.proxy.library.cornell.edu/articles/attachments?retrieve=YWFZJTsqwsCJZht8q5SLtk8I1L1cwQpm",NA,"10.1257/app.20150241","Yes","https://www-aeaweb-org.proxy.library.cornell.edu/articles/attachments?retrieve=8S-aqZJtnzEk-qzo1LtBL2TO4KwZhop_",NA,"10.1257/app.20150241",NA,"Readme file describing the dataset and how to run the program","Online Appendix",NA,"Yes","Yes",NA,"Input Data","10.1257/app.20150241",NA,"https://www-aeaweb-org.proxy.library.cornell.edu/articles/attachments?retrieve=nm-Fy8CS26e2DgD4-LhzThnVVPomeD8S","Stata",NA,NA,"No",NA,NA,NA,NA,NA,NA,NA,NA,NA,NA,NA,NA,NA,NA,NA,NA,"No",NA,NA,0
"393","6/19/2018 22:36:34","nwl27","10.1257/app.20150369","Yes",NA,NA,"10.1257/app.20150369",NA,"Confidential Data",NA,NA,NA,NA,NA,"Yes","No",NA,"Yes",NA,NA,NA,NA,NA,NA,NA,NA,NA,NA,NA,NA,NA,NA,NA,NA,NA,NA,NA,NA,NA,NA,NA,NA,NA,NA,NA,"10.1257/app.20150369",NA,"https://www-aeaweb-org.proxy.library.cornell.edu/articles/attachments?retrieve=G3xCDPMCdIPiB8icfuIUP1TXnSfvdp_D",NA,NA,"Stata","Yes","Yes","Yes","Yes","No","The README file contains the following information: ""To request access to all replication files (including data) on a secure server, email
victoria.baranov@unimelb.edu.au.""

I think this means that the datasets are procurable without having to trawl through all the URLs mentioned in the questionnaire.",4,"Yes","https://www-aeaweb-org.proxy.library.cornell.edu/articles/attachments?retrieve=G3xCDPMCdIPiB8icfuIUP1TXnSfvdp_D",NA,NA,NA,NA,"https://www-aeaweb-org.proxy.library.cornell.edu/articles/attachments?retrieve=UaqddDoeHUZRRoaiiBv5gvjRmsX7kOPt",NA,"10.1257/app.20150369","Yes","https://www-aeaweb-org.proxy.library.cornell.edu/articles/attachments?retrieve=mi-_Y9P6Ldtj38ZQMu6bAUeBXly_UZjF",NA,"10.1257/app.20150369",NA,"Readme file describing the order in which the programs should be run","Online Appendix",NA,"Yes","No",NA,NA,NA,NA,NA,NA,NA,NA,"Yes","Malawi Longitudinal Studies of Family and Health",NA,"10.1257/app.20150369","https://malawi.pop.upenn.edu/malawi-data-mlsfh",NA,"Don't Know","No","Yes","Malawi's Ministry of Health","10.1257/app.20150369",NA,"http://www.health.gov.mw/","Don't Know","No","Data is available upon request","There are also two more described input datasets:

GPS data on Malawi’s trading centers, schools, and the road network from Malawi’s National
Statistics Office (not publically available, request access from NSO http://www.nsomalawi.mw/)

GPS data on Malawi’s population density from AfriPop (now WorldPop), available online at
http://www.worldpop.org.uk/","No",NA,NA,0
"394","6/20/2018 13:05:25","nwl27","10.1257/app.20160220","Yes",NA,NA,"10.1257/app.20160220",NA,NA,NA,"10.1257/app.20160220",NA,"https://www-aeaweb-org.proxy.library.cornell.edu/articles/attachments?retrieve=02xbJ6F_NQEaxnUWLUhHKSqxQc6xAAyn",NA,NA,NA,"This is the main dataset for the article; it contains court cases after some cleaning","Yes",NA,NA,NA,NA,NA,NA,NA,NA,NA,NA,NA,NA,NA,NA,NA,NA,NA,NA,NA,NA,NA,NA,NA,NA,"Stata",NA,NA,"10.1257/app.20160220",NA,"https://www-aeaweb-org.proxy.library.cornell.edu/articles/attachments?retrieve=02xbJ6F_NQEaxnUWLUhHKSqxQc6xAAyn",NA,NA,"Stata","Yes","Yes","Yes","No","No",NA,1,"Yes","https://www-aeaweb-org.proxy.library.cornell.edu/articles/attachments?retrieve=02xbJ6F_NQEaxnUWLUhHKSqxQc6xAAyn",NA,NA,"Yes",NA,"https://www-aeaweb-org.proxy.library.cornell.edu/articles/attachments?retrieve=5ZrHdkjRkPm3rrKPZVqi0susYIKxr_Ye",NA,"10.1257/app.20160220","Yes","https://www-aeaweb-org.proxy.library.cornell.edu/articles/attachments?retrieve=bg4xaK_XE7qX_dsb5tBAV1AUy31fNm_s",NA,"10.1257/app.20160220",NA,"Readme file describing the order in which the programs should be run","Online Appendix",NA,"Yes","Yes",NA,"Analysis Data","10.1257/app.20160220",NA,"https://www-aeaweb-org.proxy.library.cornell.edu/articles/attachments?retrieve=02xbJ6F_NQEaxnUWLUhHKSqxQc6xAAyn","Stata","Analysis Data","These are auxiliary datasets to help with generating some of the figures in the article","Yes","N/A",NA,"10.1257/app.20160220",NA,NA,"Don't Know","Don't know","Yes","B'Tselem, the Israeli Information Center for Human Rights in the Occupied Territories; the Israeli National Insurance Institute; and the Israeli Ministry of Defense.","10.1257/app.20160220",NA,NA,"Don't Know","Don't know","This dataset is described as ""online transcripts of court rulings"", but because it does not point to any kind of URL it's impossible for us to know which rulings the authors used for this article.","This input data is on exposure to violence at varying levels of the judicial system","No",NA,NA,0
"395","6/20/2018 18:41:20","ap676","10.1257/app.20160597","Yes",NA,NA,NA,NA,NA,NA,NA,NA,"https://www.aeaweb.org/articles/attachments?retrieve=vxCYBjIyakb2pVu_tleLdqDSuN20uJ2W",NA,NA,NA,"Constructed by research team via data collection","Yes",NA,NA,NA,NA,NA,NA,NA,NA,NA,NA,NA,NA,NA,NA,NA,NA,NA,NA,NA,NA,NA,NA,NA,NA,"Stata, Excel",NA,NA,NA,NA,"https://www.aeaweb.org/articles/attachments?retrieve=vxCYBjIyakb2pVu_tleLdqDSuN20uJ2W",NA,NA,"Stata","Yes","Yes","No","Yes","Yes","Well-documented code, thorough readme, all necessary data included in download zip, user-written commands (inc. outreg2, qreg2) are also attached. Overall, authors have accommodated replicators well.",2,"Yes","https://www.aeaweb.org/articles/attachments?retrieve=YQlVNYyMLMqEoBZFVsQsGsjBpq4CsPAI",NA,NA,"Yes",NA,"https://www.aeaweb.org/articles/attachments?retrieve=yAd2BvRImIPw8up9xtE_5PHWpc04qsuL",NA,NA,"No",NA,NA,NA,NA,"Online Appendix","Author Disclosure",NA,"Yes","Yes",NA,"Input Data",NA,NA,"https://www.aeaweb.org/articles/attachments?retrieve=vxCYBjIyakb2pVu_tleLdqDSuN20uJ2W","Stata, Excel","Analysis Data","Sourced from the Central Bank of Chile, Reserve Bank of Malawi, Ugandan Bureau of Statistics","No",NA,NA,NA,NA,NA,NA,NA,NA,NA,NA,NA,NA,NA,NA,NA,NA,"No",NA,NA,0
"396","6/21/2018 15:29:01","nwl27","10.1257/app.20150087","Yes",NA,NA,"10.1257/app.20150087",NA,"Confidential Data",NA,NA,NA,NA,NA,"Yes","No",NA,"Yes",NA,NA,NA,NA,NA,NA,NA,NA,NA,NA,NA,NA,NA,NA,NA,NA,NA,NA,NA,NA,NA,NA,NA,NA,NA,NA,NA,"10.1257/app.20150087",NA,"https://www-aeaweb-org.proxy.library.cornell.edu/articles/attachments?retrieve=7UXIX0W12SItHm6v86tNZLQreg6AzCmw",NA,NA,"Stata","No","Yes","No","No","No",NA,5,"Yes","https://www-aeaweb-org.proxy.library.cornell.edu/articles/attachments?retrieve=7UXIX0W12SItHm6v86tNZLQreg6AzCmw",NA,NA,NA,NA,"https://www-aeaweb-org.proxy.library.cornell.edu/articles/attachments?retrieve=hzmStKBy_zBXdepIHwR3XAg_u25orHAb",NA,"10.1257/app.20150087","Yes","https://www-aeaweb-org.proxy.library.cornell.edu/articles/attachments?retrieve=iBjjIiDbZpNODnmagbSIKCDwXE8KbaLU",NA,"10.1257/app.20150087",NA,"Readme file describing the function of the programs and how to access the confidential data","Online Appendix",NA,"Yes","No",NA,NA,NA,NA,NA,NA,NA,NA,"Yes","Statistics Denmark",NA,"10.1257/app.20150087","https://www-aeaweb-org.proxy.library.cornell.edu/articles/attachments?retrieve=7UXIX0W12SItHm6v86tNZLQreg6AzCmw",NA,"Don't Know","No","No",NA,NA,NA,NA,NA,NA,"This data is from Statistics Denmark, meaning we would have to be cooperating with a Danish institution to get hold of the information; I'm pessimistic about our ability to access this data",NA,NA,NA,NA,0
"397","6/21/2018 16:24:08","ap676","10.1257/app.20150342","Yes",NA,NA,NA,NA,"Confidential Data, Redistribution not authorized, Other data download site provided",NA,NA,NA,NA,NA,"Yes","No",NA,"Yes",NA,NA,NA,NA,NA,NA,NA,NA,NA,NA,NA,NA,NA,NA,NA,NA,NA,NA,NA,NA,NA,NA,NA,NA,NA,NA,NA,NA,NA,"https://www.aeaweb.org/articles/attachments?retrieve=leXVgAYS4soa8h49lk9_SSyP4hFjz2Yn",NA,NA,"Stata","Yes","Yes","No","Yes","Yes","No datasets were included, although readme lists where each one could be acquired if needed. Furthermore, no clear instructions/cleaning programs were provided to turn these raw data files into analysis data. Otherwise, do-files to produce tables/figures appear well-documented.",4,"Yes","https://www.aeaweb.org/articles/attachments?retrieve=leXVgAYS4soa8h49lk9_SSyP4hFjz2Yn",NA,NA,NA,NA,"https://www.aeaweb.org/articles/attachments?retrieve=kaFbSqYsIMIRhmUwtzJoSk-rOfQJr-xL",NA,NA,"No",NA,NA,NA,NA,"Online Appendix","Author Disclosure",NA,"Yes","No",NA,NA,NA,NA,NA,NA,NA,NA,"Yes","Ghana Statistical Service",NA,NA,NA,NA,"Stata","Don't know","Yes","DHS",NA,NA,NA,"Stata","Yes","Requires submitting application form to the GSS","Requires (trivial) registration for access","No",NA,NA,0
"398","6/21/2018 17:58:38","nwl27","10.1257/app.20160267","Yes",NA,NA,"10.1257/app.20160267",NA,NA,NA,NA,NA,NA,NA,NA,NA,NA,"Yes",NA,NA,NA,NA,NA,NA,NA,NA,NA,NA,NA,NA,NA,NA,NA,NA,NA,NA,NA,NA,NA,NA,NA,NA,NA,NA,NA,"10.1257/app.20160267",NA,"https://www-aeaweb-org.proxy.library.cornell.edu/content/file?id=5410",NA,NA,"Stata","Yes","Yes","Yes","Yes","No",NA,1,"Yes","https://www-aeaweb-org.proxy.library.cornell.edu/content/file?id=5410",NA,NA,"No",NA,"https://www-aeaweb-org.proxy.library.cornell.edu/articles/attachments?retrieve=Tr5sm2nF5_-uhcTjYhISrcI8aRnXQ4J7",NA,"10.1257/app.20160267","Yes","https://www-aeaweb-org.proxy.library.cornell.edu/articles/attachments?retrieve=Q-O4F93P6bYXm6xisa_CGJAnEcPs6IdK",NA,"10.1257/app.20160267",NA,"Readme file describing the programs and the order in which they should be run","Online Appendix",NA,"Yes","Yes",NA,"Analysis Data","10.1257/app.20160267",NA,"https://www-aeaweb-org.proxy.library.cornell.edu/content/file?id=5410","Stata",NA,NA,"Yes","INVALSI",NA,"10.1257/app.20160267","https://www-aeaweb-org.proxy.library.cornell.edu/content/file?id=5410",NA,"Stata","No","No",NA,NA,NA,NA,NA,NA,NA,NA,"No",NA,NA,0
