"507","7/29/2018 16:42:08","nbs52","10.1257/mac.20140139","Yes",NA,NA,NA,NA,NA,NA,NA,NA,NA,NA,NA,NA,"- Does not seem to be data sets, per se. Rather, the data is constructed in the Dynare programs, and the numbers/variables are based on various other papers and sources.","No",NA,NA,NA,NA,NA,NA,NA,NA,NA,NA,NA,NA,NA,NA,NA,NA,NA,NA,NA,NA,NA,NA,NA,NA,NA,NA,NA,NA,NA,"https://www.aeaweb.org/articles/attachments?retrieve=H24SIo6zg-vB4_T_lApzTM-Sfy-t7Mz2",NA,NA,"Matlab, Dynare","Yes","No","No","No","No","- I don't think that I'll be able to replicate this one. The author includes Dynare programs, which is a software not on CISER. It requires Matlab to run, and I don't have Matlab on my personal computer. It seems as though the Matlab programs require results from the Dynare programs.",5,"Yes","https://www.aeaweb.org/articles/attachments?retrieve=4Hx4h34F2u3TxzTvjHg6SLBs3qQflr8O",NA,NA,"No",NA,NA,NA,NA,NA,NA,NA,NA,NA,"- Disclosure statement",NA,NA,"Yes","Yes",NA,"Analysis Data",NA,NA,"https://www.aeaweb.org/articles/attachments?retrieve=H24SIo6zg-vB4_T_lApzTM-Sfy-t7Mz2",NA,NA,NA,"No",NA,NA,NA,NA,NA,NA,NA,NA,NA,NA,NA,NA,NA,NA,NA,NA,"Yes",NA,NA,0
"508","7/29/2018 16:58:48","gab99","10.1257/mac.6.3.73","No",NA,NA,NA,NA,"Paper is entirely theoretical, no data was used",NA,NA,NA,NA,NA,NA,NA,NA,"Yes",NA,NA,NA,NA,NA,NA,NA,NA,NA,NA,NA,NA,NA,NA,NA,NA,NA,NA,NA,NA,NA,NA,NA,NA,NA,NA,NA,NA,NA,NA,NA,NA,NA,NA,NA,NA,NA,NA,"Paper seems entirely theoretical, and no code or data were provided. The paper does have some figures, for which no materials are provided for replication.",5,"Yes","https://www.aeaweb.org/aej/mac/app/0603/2013-0099_app.pdf",NA,NA,NA,NA,"https://www.aeaweb.org/aej/mac/ds/0603/2013-0099_ds.zip",NA,NA,"No",NA,NA,NA,NA,"Online appendix with more details on the model","Author disclosure statement",NA,"No","No",NA,NA,NA,NA,NA,NA,NA,NA,"No",NA,NA,NA,NA,NA,NA,NA,NA,NA,NA,NA,NA,NA,NA,NA,NA,"Yes",NA,NA,0
"509","7/29/2018 17:10:28","nbs52","10.1257/mac.20140147","Yes",NA,NA,NA,NA,NA,NA,NA,NA,NA,NA,NA,NA,"- No datasets provided. Variables and parameters established in the programs, based on earlier papers and models of US economy. Difficult to establish what the original sources are here.","No",NA,NA,NA,NA,NA,NA,NA,NA,NA,NA,NA,NA,NA,NA,NA,NA,NA,NA,NA,NA,NA,NA,NA,NA,NA,NA,NA,NA,NA,"https://www.aeaweb.org/aej/mac/data/0802/2014-0147_data.zip",NA,NA,"Matlab","Yes","Yes","Yes","No","Yes","- The programs don't seem to contain lines that generate figures or tables. I'll see how this goes.",3,"Yes","https://www.aeaweb.org/aej/mac/ds/0802/2014-0147_ds.zip",NA,NA,"No",NA,NA,NA,NA,NA,NA,NA,NA,NA,"- Disclosure statement",NA,NA,"Yes","Yes",NA,"Analysis Data",NA,NA,"https://www.aeaweb.org/aej/mac/data/0802/2014-0147_data.zip",NA,NA,NA,"No",NA,NA,NA,NA,NA,NA,NA,NA,NA,NA,NA,NA,NA,NA,NA,NA,"No",NA,NA,0
"510","7/29/2018 18:42:40","vsn9","10.1257/mac.6.2.1","Yes",NA,NA,NA,NA,NA,NA,NA,NA,NA,NA,NA,NA,"The Readme states ""The politics_after_crisis_replication.zip file contains the following native data files... by native data files, we mean dataset as downloaded from the original sources, as cited in the text, and converted into Stata format"".","Yes",NA,NA,NA,NA,NA,NA,NA,NA,NA,NA,NA,NA,NA,NA,NA,NA,NA,NA,NA,NA,NA,NA,NA,NA,NA,NA,NA,NA,NA,"https://www.aeaweb.org/aej/mac/data/0602/2012-0022_data.zip",NA,NA,"Stata","Yes","Yes","Yes","No","No",NA,1,"Yes","Online Appendix https://www.aeaweb.org/aej/mac/app/0602/2012-0022_app.pdf",NA,NA,"No",NA,"Author Disclosure Statement https://www.aeaweb.org/aej/mac/ds/0602/2012-0022_ds.zip",NA,NA,"No",NA,NA,NA,NA,"Online Appendix with additional tables","Author Disclosure Statement",NA,"Yes","Yes",NA,"Input Data",NA,NA,"https://www.aeaweb.org/aej/mac/data/0602/2012-0022_data.zip","Stata",NA,NA,"No",NA,NA,NA,NA,NA,NA,NA,NA,NA,NA,NA,NA,NA,NA,NA,NA,"No",NA,NA,0
"511","7/29/2018 19:14:58","vsn9","10.1257/mac.6.3.214","Yes",NA,NA,NA,NA,NA,NA,NA,NA,NA,NA,NA,NA,"Authors include input data (SAS dataset ""raw"") and analysis data (all other datasets)","No",NA,NA,NA,NA,NA,NA,NA,NA,NA,NA,NA,NA,NA,NA,NA,NA,NA,NA,NA,NA,NA,NA,NA,NA,NA,NA,NA,NA,NA,"https://www.aeaweb.org/aej/mac/data/0603/2012-0102_data.zip",NA,NA,"SAS","Yes","Yes","No","Yes","No","Reassign (requires SAS)",1,"Yes","Author Disclosure Statement https://www.aeaweb.org/aej/mac/ds/0603/2012-0102_ds.zip",NA,NA,"No",NA,NA,NA,NA,NA,NA,NA,NA,NA,"Author Disclosure Statement",NA,NA,"Yes","Yes",NA,"Input Data",NA,NA,"https://www.aeaweb.org/aej/mac/data/0603/2012-0102_data.zip","SAS",NA,NA,"No",NA,NA,NA,NA,NA,NA,NA,NA,NA,NA,NA,NA,NA,NA,NA,NA,"Yes",NA,NA,0
"512","7/30/2018 12:10:14","gab99","10.1257/mac.6.3.102","Yes",NA,NA,NA,NA,NA,NA,NA,NA,NA,NA,NA,NA,"This data set is not used in the simulation, it just contains the descriptive information for figure 1.","No",NA,NA,NA,NA,NA,NA,NA,NA,NA,NA,NA,NA,NA,NA,NA,NA,NA,NA,NA,NA,NA,NA,NA,NA,NA,NA,NA,NA,NA,"https://www.aeaweb.org/aej/mac/data/0603/2013-0085_data.zip",NA,NA,"Mathematica","Yes","No","No","No","No","This paper is a simulation using chosen parameters, so no data set is needed for the bulk of the work. The program provided runs in Mathematica, which doesn't seem to be available on CISER. The readme is only one sentence, but the replication seems simple as long as the replicator can access Mathematica.",1,"Yes","https://www.aeaweb.org/aej/mac/ds/0603/2013-0085_ds.zip",NA,NA,"No",NA,NA,NA,NA,NA,NA,NA,NA,NA,"Author disclosure statement",NA,NA,"Yes","Yes",NA,"Don't Know",NA,NA,"https://www.aeaweb.org/aej/mac/data/0603/2013-0085_data.zip",".txt",NA,NA,"No",NA,NA,NA,NA,NA,NA,NA,NA,NA,NA,NA,NA,NA,NA,NA,NA,"No",NA,NA,0
"513","7/30/2018 12:40:51","gab99","10.1257/mac.6.3.124","Yes",NA,NA,NA,NA,"Article runs simulations with chosen parameters, additional data sets are not necessary",NA,NA,NA,NA,NA,NA,NA,NA,"No",NA,NA,NA,NA,NA,NA,NA,NA,NA,NA,NA,NA,NA,NA,NA,NA,NA,NA,NA,NA,NA,NA,NA,NA,NA,NA,NA,NA,NA,"https://www.aeaweb.org/aej/mac/data/0603/2013-0037_data.zip",NA,NA,"Maple","Yes","No","No","No","No","The author does not provide a ReadMe, and the program lacks comment lines to inform the replicator on what is going on, but as long as the program runs smoothly replication should be simple. The program is written for Maple, which is available on CISER. The author does not specify what version of Maple they used and CISER has Maple 2017, so this may pose challenges.",1,"Yes","https://www.aeaweb.org/aej/mac/ds/0603/2013-0037_ds.zip",NA,NA,NA,NA,NA,NA,NA,NA,NA,NA,NA,NA,"Author disclosure statement",NA,NA,"Yes","No",NA,NA,NA,NA,NA,NA,NA,NA,"No",NA,NA,NA,NA,NA,NA,NA,NA,NA,NA,NA,NA,NA,NA,NA,NA,"No",NA,NA,0
"514","7/30/2018 13:25:13","gab99","10.1257/mac.6.3.153","Yes",NA,NA,NA,NA,NA,NA,NA,NA,NA,NA,NA,NA,"The author provides a number of data sets, the main one being dni.828.dta, but all being necessary for the smooth running of the replicate.do file.","Yes",NA,NA,NA,NA,NA,NA,NA,NA,NA,NA,NA,NA,NA,NA,NA,NA,NA,NA,NA,NA,NA,NA,NA,NA,NA,NA,NA,NA,NA,"https://www.aeaweb.org/aej/mac/data/0603/2013-0029_data.zip",NA,NA,"Stata","Yes","Yes","No","No","No","The replicate.do file is well documented and all data sets are provided. This replication should be straight forward unless there are problems with the code.",1,"Yes","https://www.aeaweb.org/aej/mac/app/0603/2013-0029_app.pdf",NA,NA,"No",NA,"https://www.aeaweb.org/aej/mac/ds/0603/2013-0029_ds.zip",NA,NA,"No",NA,NA,NA,NA,"Online appendix with further proofs","Author disclosure statements",NA,"Yes","Yes",NA,"Analysis Data",NA,NA,"https://www.aeaweb.org/aej/mac/data/0603/2013-0029_data.zip","Stata",NA,NA,"No",NA,NA,NA,NA,NA,NA,NA,NA,NA,NA,NA,NA,NA,NA,NA,NA,"No",NA,NA,0
"515","7/30/2018 14:31:18","gab99","10.1257/mac.6.3.184","Yes",NA,NA,NA,NA,NA,NA,NA,NA,NA,NA,NA,NA,"Author seems to provide input data in excel format, intermediate data in SAS format, and analysis data in STATA format, although figures 1 and 2 seem to use excel data directly.","Yes",NA,NA,NA,NA,NA,NA,NA,NA,NA,NA,NA,NA,NA,NA,NA,NA,NA,NA,NA,NA,NA,NA,NA,NA,NA,NA,NA,NA,NA,"https://www.aeaweb.org/aej/mac/data/0603/2012-0176_data.zip",NA,NA,"Stata, SAS, Mathematica","Yes","Yes","No","No","No","The replications uses STATA, SAS, and Msthematica (which is not available on CISER), as well as the STATA add-on outreg2. The replication seems time consuming, but the ReadMe is extensive and all materials seem to be provided.",2,"Yes","https://www.aeaweb.org/aej/mac/app/0603/2012-0176_app.pdf",NA,NA,"No",NA,"https://www.aeaweb.org/aej/mac/ds/0603/2012-0176_ds.zip",NA,NA,"No",NA,NA,NA,NA,"Online appendix with additional tables","Author disclosure statements",NA,"Yes","Yes",NA,"Analysis Data",NA,NA,"https://www.aeaweb.org/aej/mac/data/0603/2012-0176_data.zip","Stata, SAS, Excel",NA,NA,"Yes","IMF",NA,NA,"https://www.imf.org/en/Publications/WP/Issues/2016/12/31/Systemic-Banking-Crises-Database-An-Update-26015",NA,NA,"Yes","Yes","Kaminsky (2006)",NA,NA,NA,NA,"Don't know","Accessing this data does not seem necessary for replication.","The authors use data from her online appendix for “Currency Crises: Are They All the Same?”","No",NA,NA,0
"516","7/30/2018 15:25:20","gab99","10.1257/mac.6.2.71","Yes",NA,NA,NA,NA,"Most of the work in the article is analytical so additional data sets are not necessary",NA,NA,NA,NA,NA,NA,NA,NA,"Yes",NA,NA,NA,NA,NA,NA,NA,NA,NA,NA,NA,NA,NA,NA,NA,NA,NA,NA,NA,NA,NA,NA,NA,NA,NA,NA,NA,NA,NA,"https://www.aeaweb.org/aej/mac/data/0602/2013-0078_data.zip",NA,NA,"Matlab","Yes","Yes","Yes","Yes","No","The replication seems complicated and uses Matlab. The author provides two readmes, each with different content, but they are both informative and all programs are well documented. The programs also use Harald Uhlig's toolkit, which is provided in the data folder.",2,"Yes","https://www.aeaweb.org/aej/mac/app/0602/2013-0078_app.pdf",NA,NA,NA,NA,"https://www.aeaweb.org/aej/mac/ds/0602/2013-0078_ds.zip",NA,NA,"No",NA,NA,NA,NA,"Online appendix containing proofs of various aspects of the model","Author disclosure statements",NA,"Yes","No",NA,NA,NA,NA,NA,NA,NA,NA,"No",NA,NA,NA,NA,NA,NA,NA,NA,NA,NA,NA,NA,NA,NA,NA,NA,"No",NA,NA,0
"517","7/31/2018 13:00:22","nbs52","10.1257/mac.20140233","Yes",NA,NA,NA,NA,NA,NA,NA,NA,NA,NA,NA,NA,NA,"Yes",NA,NA,NA,NA,NA,NA,NA,NA,NA,NA,NA,NA,NA,NA,NA,NA,NA,NA,NA,NA,NA,NA,NA,NA,NA,NA,NA,NA,NA,"https://www.aeaweb.org/articles/attachments?retrieve=SwwY1bwCN1nmSRM7mOu4YO7AQfOiKHdl",NA,NA,"Matlab","Yes","Yes","Yes","No","No",NA,3,"Yes","https://www.aeaweb.org/articles/attachments?retrieve=G2Zh5bVd-lEzHRHRRIklsY6LFr0-YA4o",NA,NA,"No",NA,"https://www.aeaweb.org/articles/attachments?retrieve=oIU88As80AHuBr5WwAH6yfXhHlrcBHAQ",NA,NA,"No",NA,NA,NA,NA,"- Online Appendix","- Disclosure statement",NA,"Yes","Yes",NA,"Analysis Data",NA,NA,"https://www.aeaweb.org/articles/attachments?retrieve=SwwY1bwCN1nmSRM7mOu4YO7AQfOiKHdl","Matlab",NA,NA,"No",NA,NA,NA,NA,NA,NA,NA,NA,NA,NA,NA,NA,NA,NA,NA,NA,"No",NA,NA,0
"518","8/2/2018 16:33:45","nwl27","10.1257/mac.6.3.29","Yes",NA,NA,"10.1257/mac.6.3.29",NA,NA,NA,NA,NA,NA,NA,NA,NA,NA,"Yes",NA,NA,NA,NA,NA,NA,NA,NA,NA,NA,NA,NA,NA,NA,NA,NA,NA,NA,NA,NA,NA,NA,NA,NA,NA,NA,NA,"10.1257/mac.6.3.29",NA,"https://www-aeaweb-org.proxy.library.cornell.edu/aej/mac/data/0603/2013-0006_data.zip",NA,NA,"Stata, Fortran","Yes","Yes","No","No","Yes","This article has Fortran files, but I don't think that they are needed to replicate any of the Tables or Figures in the article, so I'm marking it as a 2",2,"Yes","https://www-aeaweb-org.proxy.library.cornell.edu/aej/mac/data/0603/2013-0006_data.zip",NA,NA,"No",NA,"https://www-aeaweb-org.proxy.library.cornell.edu/aej/mac/app/0603/2013-0006_app.pdf",NA,"10.1257/mac.6.3.29","Yes","https://www-aeaweb-org.proxy.library.cornell.edu/aej/mac/ds/0603/2013-0006_ds.zip",NA,"10.1257/mac.6.3.29",NA,"Readme file describing the order in which the programs should be rn","Online Appendix",NA,"Yes","Yes",NA,"Analysis Data","10.1257/mac.6.3.29",NA,"https://www-aeaweb-org.proxy.library.cornell.edu/aej/mac/data/0603/2013-0006_data.zip","Stata",NA,NA,"Yes","Health and Retirement Study",NA,"10.1257/mac.6.3.29","https://hrs.isr.umich.edu/data-products",NA,"Don't Know","Yes","Yes","Federal Interagency Forum on Aging-Related Statistics","10.1257/mac.6.3.29",NA,"https://agingstats.gov/","Don't Know","Yes",NA,NA,"No",NA,NA,0
"519","8/2/2018 17:33:07","jhv39","10.1257/mac.6.2.137","Yes",NA,NA,NA,NA,"Confidential Data, Proprietary Data",NA,NA,NA,NA,NA,"Yes","No",NA,"No",NA,NA,NA,NA,NA,NA,NA,NA,NA,NA,NA,NA,NA,NA,NA,NA,NA,NA,NA,NA,NA,NA,NA,NA,NA,NA,NA,"10.1257/mac.6.2.137",NA,"https://www.aeaweb.org/aej/mac/data/0602/2012-0174_data.zip",NA,NA,"Stata, SAS","No","Yes","No","No","No",NA,5,"Yes","https://www.aeaweb.org/aej/mac/ds/0602/2012-0174_ds.zip",NA,NA,NA,NA,NA,NA,NA,NA,NA,NA,NA,NA,"Disclosure Statements",NA,NA,"Yes","No",NA,NA,NA,NA,NA,NA,NA,NA,"Yes","Bureau of Labor Statistics",NA,NA,"http://www.bls.gov/pir/",NA,NA,"No","Yes","Data collected from ""a large Supermarket retailer""",NA,NA,NA,NA,"No","Must apply for access","No specific data given on which retailer, but access application info can be found in the data folder","No",NA,NA,0
"520","8/2/2018 18:11:23","jhv39","10.1257/mac.6.2.156","Yes",NA,NA,NA,NA,NA,NA,NA,NA,NA,NA,NA,NA,"Data used in construction of theoretical models. Empirical datasets restricted.","No",NA,NA,NA,NA,NA,NA,NA,NA,NA,NA,NA,NA,NA,NA,NA,NA,NA,NA,NA,NA,NA,NA,NA,NA,NA,NA,NA,NA,NA,"https://www.aeaweb.org/aej/mac/data/0602/2012-0138_data.zip",NA,NA,"Matlab","Yes","Yes","No","No","No",NA,3,"Yes","https://www.aeaweb.org/aej/mac/ds/0602/2012-0138_ds.zip",NA,NA,"No",NA,NA,NA,NA,NA,NA,NA,NA,NA,"Disclosure Statements",NA,NA,"Yes","Yes",NA,"Analysis Data",NA,NA,"https://www.aeaweb.org/aej/mac/data/0602/2012-0138_data.zip","Matlab, Excel",NA,NA,"Yes","Bureau of Labor Statistics",NA,NA,"http://www.bls.gov/bls/blsresda.htm",NA,"Matlab","No","No",NA,NA,NA,NA,NA,NA,"Requires application at BLS website (linked)",NA,NA,NA,NA,0
"521","8/4/2018 0:57:15","vsn9","10.1257/mac.6.1.1","Yes",NA,NA,NA,NA,NA,NA,NA,NA,NA,NA,NA,NA,"Includes both the raw input data (raw_data.xlsx) & the transformed analysis data (usdata.txt). Data source & transformation process described in ReadMe.txt.","Yes",NA,NA,NA,NA,NA,NA,NA,NA,NA,NA,NA,NA,NA,NA,NA,NA,NA,NA,NA,NA,NA,NA,NA,NA,NA,NA,NA,NA,NA,"https://www.aeaweb.org/aej/mac/data/0601/2012-0185_data.zip",NA,NA,"File extensions are .g & .src","Yes","Yes","No","Yes","Yes","Data is readily available & Readme files are detailed & precise but the programs seem pretty obscure",2,"Yes","Online Appendix https://www.aeaweb.org/aej/mac/app/0601/2012-0185_app.pdf",NA,NA,"No",NA,"Author Disclosure Statement https://www.aeaweb.org/aej/mac/ds/0601/2012-0185_ds.zip",NA,NA,"No",NA,NA,NA,NA,"Online Appendix with derivations/computations (theoretical), robustness checks,  & model extension with a table of new estimates","Author Disclosure Statement",NA,"Yes","Yes",NA,"Input Data",NA,NA,"https://www.aeaweb.org/aej/mac/data/0601/2012-0185_data.zip","Excel, .txt",NA,NA,"No",NA,NA,NA,NA,NA,NA,NA,NA,NA,NA,NA,NA,NA,NA,NA,NA,"Yes",NA,NA,0
"522","8/4/2018 14:25:57","vsn9","10.1257/mac.6.1.162","Yes",NA,NA,NA,NA,NA,NA,NA,NA,NA,NA,NA,NA,"Survey of Consumer Finances (2001) data. Authors converted SAS data file from the Board of Governors of the Federal Reserve System to a Stata file. Links to original SAS file & macro are included in the Readme (both work).","No",NA,NA,NA,NA,NA,NA,NA,NA,NA,NA,NA,NA,NA,NA,NA,NA,NA,NA,NA,NA,NA,NA,NA,NA,NA,NA,NA,NA,NA,"https://www.aeaweb.org/aej/mac/data/0601/2011-0132_data.zip",NA,NA,"Stata, Matlab, Fortran","Yes","Yes","No","No","Yes","Replication procedure looks quite involved (requires several ""libraries"") and requires knowledge/access to Fortran in addition to Matlab and Stata.",3,"Yes","Author Disclosure Statement https://www.aeaweb.org/aej/mac/ds/0601/2011-0132_ds.zip",NA,NA,"No",NA,NA,NA,NA,NA,NA,NA,NA,NA,"Author Disclosure Statement",NA,NA,"Yes","Yes",NA,"Input Data",NA,NA,"https://www.aeaweb.org/aej/mac/data/0601/2011-0132_data.zip","Stata, Excel",NA,NA,"No",NA,NA,NA,NA,NA,NA,NA,NA,NA,NA,NA,NA,NA,NA,NA,NA,"Yes",NA,NA,0
"523","8/4/2018 15:05:12","vsn9","10.1257/mac.6.4.246","Yes",NA,NA,NA,NA,NA,NA,NA,NA,NA,NA,NA,NA,"No description of data in article or readme file. ""Data"" appears to be model-based/theoretical (not pulled from some empirical source).","No",NA,NA,NA,NA,NA,NA,NA,NA,NA,NA,NA,NA,NA,NA,NA,NA,NA,NA,NA,NA,NA,NA,NA,NA,NA,NA,NA,NA,NA,"https://www.aeaweb.org/aej/mac/data/0604/2012-0224_data.zip",NA,NA,"Matlab, Dynare","Yes","No","No","No","No","Replication procedure looks quite involved and requires Dynare programming experience.",2,"Yes","Author Disclosure Statement https://www.aeaweb.org/aej/mac/ds/0604/2012-0224_ds.zip",NA,NA,"No",NA,NA,NA,NA,NA,NA,NA,NA,NA,"Author Disclosure Statement",NA,NA,"Yes","Yes",NA,NA,NA,NA,"https://www.aeaweb.org/aej/mac/data/0604/2012-0224_data.zip","Matlab, log files",NA,NA,"No",NA,NA,NA,NA,NA,NA,NA,NA,NA,NA,NA,NA,NA,NA,NA,NA,"Yes",NA,NA,0
"524","8/4/2018 15:43:33","nwl27","10.1257/mac.6.2.29","Yes",NA,NA,"10.1257/mac.6.2.29",NA,NA,NA,NA,NA,NA,NA,NA,NA,NA,"Yes",NA,NA,NA,NA,NA,NA,NA,NA,NA,NA,NA,NA,NA,NA,NA,NA,NA,NA,NA,NA,NA,NA,NA,NA,NA,NA,NA,"10.1257/mac.6.2.29",NA,"https://www-aeaweb-org.proxy.library.cornell.edu/aej/mac/data/0602/2012-0273_data.zip",NA,NA,"Stata","Yes","Yes","No","No","Yes",NA,1,"Yes","https://www-aeaweb-org.proxy.library.cornell.edu/aej/mac/data/0602/2012-0273_data.zip",NA,NA,"No",NA,"https://www-aeaweb-org.proxy.library.cornell.edu/aej/mac/ds/0602/2012-0273_ds.zip",NA,"10.1257/mac.6.2.29","No",NA,NA,NA,NA,"Readme file describing the programs to be run","Author Disclosure Statement(s)",NA,"Yes","Yes",NA,"Analysis Data","10.1257/mac.6.2.29",NA,"https://www-aeaweb-org.proxy.library.cornell.edu/aej/mac/data/0602/2012-0273_data.zip","Stata",NA,NA,"Yes","WTO",NA,"10.1257/mac.6.2.29",NA,NA,"Don't Know","Don't know","No",NA,NA,NA,NA,NA,NA,"The input data is very vaguely described, and the link to the online appendix that holds information about all the data sets is a 404",NA,"No",NA,NA,0
"525","8/4/2018 16:08:38","jhv39","10.1257/mac.6.1.134","Yes",NA,NA,NA,NA,NA,NA,NA,NA,NA,NA,NA,NA,"Taken from the SIPP (Study of Income and Program Participation)","Yes",NA,NA,NA,NA,NA,NA,NA,NA,NA,NA,NA,NA,NA,NA,NA,NA,NA,NA,NA,NA,NA,NA,NA,NA,NA,NA,NA,"10.1257/mac.6.1.134/replication-jhv39",NA,"https://www.aeaweb.org/aej/mac/data/0601/2012-0034_data.zip",NA,NA,"Stata, Matlab","Yes","Yes","Yes","No","No",NA,3,"Yes","https://www.aeaweb.org/aej/mac/ds/0601/2012-0034_ds.zip",NA,NA,"No",NA,NA,NA,"https://www.aeaweb.org/aej/mac/app/0601/2012-0034_app.pdf","No",NA,NA,NA,NA,"Disclosure Statements","Appendix",NA,"Yes","Yes",NA,"Analysis Data",NA,NA,"https://www.aeaweb.org/aej/mac/data/0601/2012-0034_data.zip","Stata, Matlab",NA,NA,"No",NA,NA,NA,NA,NA,NA,NA,NA,NA,NA,NA,NA,NA,NA,NA,NA,"No",NA,NA,0
"526","8/5/2018 14:49:27","gab99","10.1257/mac.6.2.207","Yes",NA,NA,NA,NA,NA,NA,NA,NA,NA,NA,NA,NA,"The author provides ""original data"" and then programs that produce .mat files with the data necessary to run the figure#.m files, which reproduce the figures in the model. The analysis files are also provide, so the figures can be replicated without replicating the data cleaning.","Yes",NA,NA,NA,NA,NA,NA,NA,NA,NA,NA,NA,NA,NA,NA,NA,NA,NA,NA,NA,NA,NA,NA,NA,NA,NA,NA,NA,NA,NA,"https://www.aeaweb.org/aej/mac/data/0602/2012-0018_data.zip",NA,NA,"Matlab","Yes","No","No","No","No","This article is replicable entirely with matlab, the ReadMe seems complete, and the author provides all necessary data. The code files are poorly documented but the ReadMe should be comprehensive enough to make replication a smooth process.",1,"Yes","https://www.aeaweb.org/aej/mac/app/0602/2012-0018_app.pdf",NA,NA,"No",NA,"https://www.aeaweb.org/aej/mac/ds/0602/2012-0018_ds.zip",NA,NA,"No",NA,NA,NA,NA,"Online appendix which defines data sources and provides additional figures.","Author disclosure statements",NA,"Yes","Yes",NA,"Input Data",NA,NA,"https://www.aeaweb.org/aej/mac/data/0602/2012-0018_data.zip","Matlab, Excel",NA,NA,"No",NA,NA,NA,NA,NA,NA,NA,NA,NA,NA,NA,NA,NA,NA,NA,NA,"No",NA,NA,0
"527","8/5/2018 15:24:51","gab99","10.1257/mac.6.1.190","Yes",NA,NA,NA,NA,NA,NA,NA,NA,NA,NA,NA,NA,"The author sources publicly available data from the Bureau of Labor Statistics (BLS), and provides their data set, but does not provide a link to the data sets from which the author compiled their data.","No",NA,NA,NA,NA,NA,NA,NA,NA,NA,NA,NA,NA,NA,NA,NA,NA,NA,NA,NA,NA,NA,NA,NA,NA,NA,NA,NA,NA,NA,"https://www.aeaweb.org/aej/mac/data/0601/2012-0220_data.zip",NA,NA,"Matlab, Dynare","Yes","Yes","Yes","Yes","No","The programs are well documented and the readme is thorough, but does not provide very specific instructions as to any necessary order that the programs should be run in. Also, many of provided files are dynare functions that are called upon by matlab codes.",2,"Yes","https://www.aeaweb.org/aej/mac/ds/0601/2012-0220_ds.zip",NA,NA,"No",NA,NA,NA,NA,NA,NA,NA,NA,NA,"Author disclosure statement",NA,NA,"Yes","Yes",NA,"Analysis Data",NA,NA,"https://www.aeaweb.org/aej/mac/data/0601/2012-0220_data.zip",".txt",NA,NA,"No",NA,NA,NA,NA,NA,NA,NA,NA,NA,NA,NA,NA,NA,NA,NA,NA,"No",NA,NA,0
"528","8/6/2018 14:25:33","gab99","10.1257/mac.20140097","Yes",NA,NA,NA,NA,NA,NA,NA,NA,NA,NA,NA,NA,"The data provided is in four data sets and comes from a number of input data sets.","Yes",NA,NA,NA,NA,NA,NA,NA,NA,NA,NA,NA,NA,NA,NA,NA,NA,NA,NA,NA,NA,NA,NA,NA,NA,NA,NA,NA,NA,NA,"https://www.aeaweb.org/aej/mac/data/0701/2014-0097_data.zip",NA,NA,"Matlab","Yes","Yes","No","No","No","This paper contains a abnormally large number of matlab code files. The full replication process seems intensive but the author provides a ""quick run guide"" which details how to replicate the figures without running all of the parameters and models programs. All programs are matlab.",2,"Yes","https://www.aeaweb.org/aej/mac/app/0701/2014-0097_app.pdf",NA,NA,"No",NA,"https://www.aeaweb.org/aej/mac/ds/0701/2014-0097_ds.zip",NA,NA,"No",NA,NA,NA,NA,"Online appendix with a description of the data used and additional figures.","Author disclosure statements",NA,"Yes","Yes",NA,"Analysis Data",NA,NA,"https://www.aeaweb.org/aej/mac/data/0701/2014-0097_data.zip","Matlab, .txt",NA,NA,"Yes","Bureau of Economic Analysis, Bureau of Labor Statistics, Survey of Professional Forecasters",NA,NA,NA,NA,NA,"Don't know","No",NA,NA,NA,NA,NA,NA,"The author lists their sources and the surveys from the sources that they use but not the years of those surveys so obtaining the input data is challenging, but it seems like they provide all necessary variables from these data sets in the replication folder.",NA,"No",NA,NA,0
"529","8/6/2018 15:44:33","xw435","10.1257/mac.20130057","Yes",NA,NA,NA,NA,NA,NA,NA,NA,NA,NA,NA,NA,NA,"No",NA,NA,NA,NA,NA,NA,NA,NA,NA,NA,NA,NA,NA,NA,NA,NA,NA,NA,NA,NA,NA,NA,NA,NA,NA,NA,NA,NA,NA,"https://www.aeaweb.org/aej/mac/data/0703/2013-0057_data.zip",NA,NA,"Stata, Matlab","Yes","Yes","No","No",NA,NA,2,"Yes","https://www.aeaweb.org/aej/mac/ds/0703/2013-0057_ds.zip",NA,NA,"No",NA,NA,NA,NA,NA,NA,NA,NA,NA,"Author Disclosure Statement",NA,NA,"Yes","Yes",NA,"Analysis Data",NA,NA,"https://www.aeaweb.org/aej/mac/data/0703/2013-0057_data.zip","Stata, Excel",NA,NA,"Yes",NA,NA,NA,"http://databank.worldbank.org/data/reports.aspx?source=world-development-indicators#",NA,"CSV, Excel","Yes","Yes",NA,NA,"hdl://1902.1/10684",NA,"Stata","Yes","World Bank Data (World Development Indicators)","35 Sector KLEM",NA,NA,NA,0
"530","8/6/2018 15:51:20","gab99","10.1257/mac.20130326","Yes",NA,NA,NA,NA,"Proprietary Data",NA,NA,NA,NA,NA,"Yes","No",NA,"Yes",NA,NA,NA,NA,NA,NA,NA,NA,NA,NA,NA,NA,NA,NA,NA,NA,NA,NA,NA,NA,NA,NA,NA,NA,NA,NA,NA,NA,NA,"https://www.aeaweb.org/articles/attachments?retrieve=K7m8mlwx5Sa2s8BVczyXBqLf-fUIHXVf",NA,NA,"Stata, c++","No","No","No","No","No","The article is mostly replicable in STATA (all figure replication files are in STATA), but the model replication is in c++. Also, the links provided by the authors to the proprietary data sets do not actually lead to data sets, just organization home pages. With searching the data sets may be found, but an application process is necessary.",4,"Yes","https://www.aeaweb.org/articles/attachments?retrieve=65mgoHuumMsU7mHNEW4ZW2lXE8Tzq3e-",NA,NA,NA,NA,"https://www.aeaweb.org/articles/attachments?retrieve=8zNDP9uSojAdgYpStCMM7SeFHR0niBPO",NA,NA,"No",NA,NA,NA,NA,"Online appendix with information on the data, econometric identification, and additional tables.","Author disclosure statement",NA,"Yes","No",NA,NA,NA,NA,NA,NA,NA,NA,"Yes","TransUnion",NA,NA,"https://www.transunion.com",NA,NA,"No","Yes","CoreLogic",NA,NA,"https://www.corelogic.com/insights/loan-performance-insights-report.aspx",NA,"No","Think link provided by the author to the data set leads to TransUnion's homepage, which is geared towards personal finance help. There are other tabs (business and government) but I was unable to find specific instructions on how to obtain the RMBS dataset, so using the ""request more information"" option seems to be the best option.","This data set requires the replicator fill out an information form on the right side of the screen when following the provided link. The authors say the dataset is proprietary, but whether or not one must pay for access is unclear.","No",NA,NA,0
